description,id,name
使用 EasyComment - Free Youtube Comment Finder 帮助您对youtube 评论进行Picker、导出、生成以及分析。,fifgmgcoibgcehfbpeifpipjnmfdjcoi,EasyComment - Youtube 评论搜索&生成&分析&导出工具
Cleanflight飛控系統的跨平台參數配置工具軟體,fbhajdegoghjmambnhifapbomifbfgdd,Cleanflight配置器
A simple chrome extension to show posters on chromebit.,peccohmojphalnfgfkamdhhoaeghglde,SlidePlayer
阻止浪費的網站，您可以節省時間和體驗。,offgfkdlmpggepbfdgmhgoinlpaahdnn,站點阻止：阻止網站和重點研究
"This application supports digital signage, in-store and on-hold music and audio messaging.  It is intended for use with the…",cebpalfddnopbabckfajpbcmmimickei,Digital Signage
"Fun Box - is a handy extension with collections of gifs, emojis and stickers.",fcgmgjnnohnmfaafkjpbinakabldfbag,"Fun Box - Emoji, Stickers, Gifs"
翻譯選擇的文本與谷歌翻譯,fbimffnjoeobhjhochngikepgfejjmgj,翻譯選取文字
排球少年壁紙擴展程序重新定義了您的Chrome新標籤頁成為排球少年的背景壁紙。排球少年粉絲的主題。,noodlbmikaaeebbhblpdddjndggfelan,排球少年壁紙高清
一直是您生命的守護者,ckgnbggddjngeimfhklbnnbdmhmpekng,先見基因
Print Shopee orders using Prowill Label Printers,jadbbpfkihkcaclolhkbnfmppppdiohf,Prowill Print Assistant for Shopee
Transmate provide bulk document processing capability to ChatGPT and Poe.,lghfplkciemadbeobmddljkjabhjkcmm,Transmate: AI-powered Bulk Translator
Head Soccer is a best game you can play right on Chrome™ Browser! Offline and Popup Version!,ocfdgmgbhncnjdcbkajgankjnondmlng,Head Soccer Unblocked Games
"Studentská kuchařka pro všechny, kteří bydlí na kolejích, intrech, privátech, nebo si prostě jen chtějí uvařit něco rychlého doma.…",hpjlegfdlimlljjjdblcbffdbfjpcfei,Studentská kuchařka
Monkey Mart is best game from monkeymart.org you can play right on Chrome™! Popup and Offline! Have fun!,fajhobhekodlmbmelmejbjcjjhgahhkj,Monkey Mart Unblocked Game
為您自動發現並測試所有有效優惠碼！,gdnhngmilhhebigaokmniikdlcjbcbhg,Moolah - 自動搜索最佳優惠劵
凍結暫時用不到的分頁，達到系統資源釋放。,noogafoofpebimajpfpamcfhoaifemoa,The Marvellous Suspender
Marlies Dekkers 是荷蘭的內衣設計師，作品被國際視為前衛、引領潮流與創新的典範。她的特色在於，總在令人意想不到的內衣位置添加傳統浪漫的蕾絲緞帶，強烈表現出線條、層次和精緻的剪裁。Marlies Dekkers 的內衣是為了取悅女人而設計...,fepnljgdbelppefncogilfbjikmnbhjm,Marlies Dekkers
自動更新壁紙或從Google™圖片搜索壁紙來自定義您的Chrome新標籤頁。,lekinkiooojdphkejcelmalajhmoacak,Ariana Grande新標籤，定制壁紙HD
此工具可以加快學術研究人員快速瀏覽學術內容。4xDev(4-x.tw),llabigmoncehmkaeggjogejadhfkcfaa,SScholar
如何從Tiktok廣告庫中下載無浮水印的Tiktok廣告,mmobcmjnglldkacpapndkhelccogipnd,如何從Tiktok廣告庫中下載無浮水印的Tiktok廣告
如果你是一個真正的時裝愛好者，你一定是時尚而新潮的，檢查出的各種時尚潮流。,afjpndoafdjllgigcchcakilcbmpimob,時尚遊戲
高效管理 Notion 的顏色文字與註解。,hipgmnlpnimedfepbfbfiaobohhffcfc,Notion+ 標記管理器
鍵盤快捷鍵可快速啟動Sports Apps：ESPN，247Sports。,oflkhhepnnchagidpfpbcljmaoflonnl,體育鍵盤啟動器
Five Nights at Freddy's wallpapers bring your chrome a new look and useful tools,ggnblkcmkokilofcdfjpkeoebmlpggac,Five Nights at Freddy's Wallpapers
"PlanDo 是個可以即興參加活動(Gathering)的平台。

在 PlanDo 你能很容易的結識到在你周圍的朋友，在PlanDo平台上極速gathering！

=== 熱門gathering活動===  
• 食飯
• 飲咖啡
• 睇電影
• 水上滑板…",okjjkldipciafneglgobhdkegilfmapd,PlanDo
"A tool for business leads, one click to find lead from Google Maps, includes phone numbers, emails, social media profiles, and more.",ofidhibmldckbehmlhliopoikmaocoma,G Business Explorer - G Map Leads Finder
在瀏覽器上玩經典的吃豆子遊戲,pnepheaiaknbmdngnnnneaeejahjiada,吃豆子離線遊戲
使用吸管工具從頁面中單擊獲取顏色,jbngkbpfcplopniblkndojcmplnjonhm,顏色選擇 X
在新分頁中顯示書籤,oennmljgpcdepcmclcmbhinchoogonjb,書籤新分頁
最好用的YouTube視頻總結工具，結合最新Bing Chat智能AI，生成視頻字幕和總結。,aohgbidimgkcolmkopencknhbnchfnkm,YouTube視頻摘要生成器 - Bing Chat（中文版）
在ChatGPT插件商店裡快速搜索到想要的插件,mjekmollinipocojphojddkenddjeojh,ChatGPT Plugin Finder - 搜索 ChatGPT 插件
解除『考滿分』區域限制 A Chrome and Firefox extension that bypasses KMF region restriction.,jlbknbfjajehjmfjegefddgegipadonb,KMF-Unblock
具有音樂流派預設和低音增強器功能的音頻均衡器。 改善聲音！,paahdfldanmapppepgbflkhibebaeaof,具有流派的低音增強器和聲音均衡器
WordBranch extension,kjndbjjemldogkjbpfhjfjmgfkhbpkhm,WordBranch
從任何網站隱藏您的地理位置。,kdfdijodcdipljclcgifekbfdolociob,隱藏位置
Browse BGG image by a popup image viewer.,bnbkfponohpobjnkglgbiojemigolnhf,BoradGameGeek Image Viewer
HIFANA 是由 KEIZOmachine! 與 Juicy 這兩位擅長碎拍的 DJ 搭檔組成。這個主題是根據他們的第二張專輯《Channel H》中的《Wamono》一曲的圖像而製成。,bmhjjmolopikkbigemoocmebohfpnmkj,HIFANA X W+K TOKYO LAB
twitch 各式小工具,gmojchmfkdpbmcboingdhcpaejpffhem,Twitch 小工具
瀏覽器擴充套件，提供閱讀模式、複製、翻譯、語音、PDF 和 Markdown 導出等功能。,odfonlkabodgbolnmmkdijkaeggofoop,Clearly Reader - 必備閱讀助手
Integration powered by Loup,cpnjmoagebgcpebjocgfklohgdmlgpnf,Loup
速度測試應用程序是衡量您的互聯網速度的最快捷、最簡單的方法,hpfjcncgnjdheiakpdilaebjhlbminhg,速度測試
udemy 線上課程的 notion 筆記小幫手,becidedomcekioalnenhdnaafhfdmfhe,Learning Notes Plus for udemy
使用 AEON.to 將 AEON 直接轉帳到 Bitcoin 的地址,mofbdbepolljimpkacjjcfdimoblfpio,AEON.to Lens
,fipkndomnjhogflhnkkokhjpgffdaafa,PlayIt App Player
秋壁紙擴展程序重新定義了您的Chrome新標籤頁成為秋的背景壁紙。秋粉絲的主題。,ahkbbmheonkjjoccjhhohflmhneicmaa,秋壁紙
FusionPass 是一款安全、免費、跨平台的密碼管理工具。,kaiadoiaghdmbdnnibemmmfohbpienoi,FusionPass Internal - 免費密碼管理工具
您的語言學習副駕駛,ccmjdgjljbhkkhhgdabpdkjhnningbdc,平行文本
事件發生的時候，製造一點聲響。,bhookghbiabmdcjpphjikookipcddidk,Noise
"Hashtag Summariser lets you summarise a twitter hashtag.

What is unique about it is that it will summarise based on the popularity…",aobhenfidliacfgehbnmadmnhphkfoan,Hashtag Summariser
"Assassin`s Creed Valhalla Full HD Wallpapers brings a new look to your Chrome, Edge and Brave browser",mpcmnahnedefhihgkjdjfkhjcibddnkk,Assassin`s Creed Valhalla Wallpaper New Tab
"VOCALOID 3 - KAITO V3 Theme                                                             


Fits all resolutions up to 1920 x 1080…",enjmfphldljfcpecccjickmfikjjgdkh,VOCALOID3 - KAITO V3 Ver.2
讓你可以標記再也不想點進去看的物件，節省時間，並大輻增加找到喜愛的租屋的可能性！,jmnpgjdddninopidgceofjgifpcjldid,591 租屋過濾小幫手
Free trial extension for test.,djkgoigddcdggafooabnjooedmbpllce,Jyo test emoji
做最好用的上網時間統計工具。,dkdhhcbjijekmneelocdllcldcpmekmm,網費很貴 - 上網時間統計
God Of War 1920X1080,necfmjkebkolpabchljigekgdpolfpie,God Of War 1920X1080
作為Chrome擴充功能玩Retrol Bow Unblocked - 也可以在沒有網路的情況下玩，現在就試試看吧！,oaiboanpaglmjlekjeoegmccdjgacnjg,Retrol保齡球未被阻擋
Find your starwish,hbmgaobdhcamjlbgccanfldpnhkiaank,Starwish Manager
通過單擊並選擇喚醒時間來休眠選定的選項卡。指定相對時間或絕對時間，然後輸入提醒信息。如果該選項卡最近關閉，則該選項卡的歷史記錄也會恢復。,iimpkmjmadhfhnoammcenbchdelfckio,休眠專家
"WAblue tools, send bulk messages, chatbot and much more, with PDF of Marketing.",lomndjbnijhfkapokbmimdnailjmfmch,WAblue Tools Bulk Sender and Chatbot
適用於 Chrome 的最佳廣告攔截器，無需請求特定權限即可阻止廣告和跟踪器。,ljaejgfmcchjjfhmgjgkfkmolmlncedf,免費廣告攔截器
Fairy Tail 1366x768,kpillibpdfelpnkikalphfhnlnokeoco,Fairy Tail 1366x768
"Naruto New Tab Wallpapers & Games, designed just for naruto lovers. Changes your new tab with an epic naruto new tab wallpapers.",ojjmnljhdcmedngpmahdlegoagpjocga,Naruto Wallpaper HD Custom New Tab
,gidpiecgjlkkcpnahmhmbhelgldbenea,找廁所
Customise music by volume booster tool. Allows to increase the volume of your audio and video files. Sound booster,cejhlkhieeooenehcfmcfgpcfjdhpkop,Volume Booster: Sound Booster tool
"The image of the theme is from ""UROBOROS""  the 7th ALBUM of  the Japanese  band - DIR EN GREY.

Fits all resolutions up to 1920 x…",bdbdagiamjjbbaohhenfkhdjgebdliof,DIR EN GREY - UROBOROS
Integration powered by Tele Cloud Click,eehiccajflnokjleicpdjdmmohghanom,Tele Cloud Click
新增 iGetter 項目特色選單指令,kefncalcphllnknagnlnfcndlehpkpck,iGetter Extension
使用 BitComet 下載檔案,dhigneefebkcagnpnpbibganpmfgebnk,BitComet 擴充外掛程式
This extension allows users to easily search unknown words by right-click on webpages. Codeing by zino.,jedelenoicpnncgnjbefafeoljkhcoca,Cambridge Search
使用虛擬鍵盤輸入文字。它提供了包括虛擬鍵盤輸入文字的援助。,ojodoncimdcjibigapbjcgeicgeecanl,虛擬鍵盤
"2016 Hindi and English daily GK (General Awareness), current affairs, business and English Language questions given in the form of…",bmmmmnenhplfjdclemkddbfadmmponpj,Daily GK
Allows user to use ChatGPT with WhatsApp Web,njanbanagbejgkplmphkmmkkolfaielm,Articue WhatsApp ChatGPT
使用鼠標選擇文本時，使用有用的工具（複製，搜索，翻譯，突出顯示等）彈出用戶菜單。,npohodmlkdednnlbhfegpnhohpgckocf,SelectionSK
"Winter Snow Silhouette theme brings a new look to your Chrome, Edge and Brave browser",kjnmeemaghijckclclidkfphcoglodcf,Winter Snow Silhouette
Play the 3rd World in the Fancy Pants Adventures!,fmdbneehalinphgabinfklbafhehaidn,Fancy Pants Adventure World 3
破乎去广告,bfcipppcpbdihflhjldpicnibakneknl,Pohu get back
Quickly minify XML files to save space and optimize your speed,ghinnndkamefjllodamdlcnklobfebaj,XML Minifier
用Markdown寫一封漂亮的電子郵件。,elifhakcjgalahccnjkneoccemfahfoa,Markdown Here
飛天主題，帶有2012年1月的日曆。,fkhblefkgckphhbdmpjcabbnbghcmima,Angel Chrome Theme - Arthur
具有音樂流派預設和低音增強器功能的音頻均衡器。 改善聲音！,ejigejogobkbkmkgjpfiodlmgibfaoek,具有流派的低音增強器和聲音均衡器
League of Legends Lee Sin 1366x768,okdcboflkihnfcagjlmiaicjilnfkfpk,League of Legends Lee Sin 1366x768
League of Legends Yasuo 1920X1080,ifjdkgnanmlcglijckpeahocdheccnhd,League of Legends Yasuo 1920X1080
允許您使用工具欄按鈕，按下Alt + Shift + W鍵的右鍵菜單或項目關閉其他標籤頁。,hlgfnmhokcceeipoadecmcgfijbnjpjm,關閉其他標籤頁
Ihr Supermarkt für die Hosentasche. Mit der preisgekrönten REWE Supermarkt App können Sie Ihre Lebensmittel beim REWE Lieferservice…,egjmmcdonkknfljkmdedoidgogadpilp,REWE
Knife Hit the target above and become the greatest knife master. Play right on Chrome™ Browser!,kmmpghckoinifmdgfflanmkhnmhhjeff,Knife Hit Unblocked
防止不小心打開內容農場的文章,opjaibbmmpldcncnbbglondckfnokfpm,封鎖內容農場
免費的在線國際象棋遊戲。現在在一個乾淨的界面下棋。玩國際象棋的計算機。,jijlohjfomooibbolpklijpccaonpmok,棋牌遊戲
接著我們可以點一下畫面中的油漆刷按鈕，分別為工具列、標籤頁、使用中的標籤…等項目挑選你喜歡的色彩。設定好之後按「Continue to Step 3」按鈕，繼續下一步。,lhigpgfapcmdaphpndoolljlijmjdbib,111
NTPU survey auto-complete tool.,pfpifpebebjdmmdpnmhomajadpfekjle,Veranda
獲取取全高清的應用圖標、專輯封麵、圖書封麵、電影海報等等。支持所有 iTunes 以及 Mac App Store 商店中的內容,pjdeblccplohlgedbefopohaedodcgci,Artwork Grabber (封面提取)
從PDF文件、掃描文件和圖片中提取表格數據。捕捉存儲在任何文檔中的表格結構中的相關數據，並保存到電子表格中。,chcphpeifolppcfemopkgpbkenaoijpl,表格OCR - 從PDF/圖片中提取表格數據
硬是要縮,efceaemlnabjahlebbmejdafdmpofgop,硬是要縮
"Now you can play T-Rex - Dino Game right on Chrome™ Browser! Offline and Popup Version, without internet required!",mkakmlciocboabblblpjongpppfccbna,T-Rex - Dino Game
"Quickly extract contest entry info like usernames, profile links etc. to spreadsheet with this 1-click browser extension.",idfcdgofkeadinnejohffdlbobehndlf,Instagram Comment Assistant
Search your facebook,dfadjoihphkocdhpcfckpjhppjkgedcj,Social Search
Integration powered by TANETWORKS,abgmhbcocmcapefjlkbdcmhkpnihmlgk,TANETWORKS
Integration powered by Tel-A-Friend,gnmhmbhpmjhbcfidkjoehgoakhlfhkhc,Tel-A-Friend
Persona 5 1920X1080,ffhcbagiopbdjhbjeijhfgnficokedhh,Persona 5 1920X1080
如果你是一個9號球玩家，你會明白這個遊戲是在測試你的膽量。祝你愉快！,oafdgpdaojfjhcolidaakebmnbibdbpb,9號球
Re Zero 1920X1080,kajigacmopiickkonnaehddafapplhea,Re Zero 1920X1080
一個搭載人工智慧的郵件助手，可在多種語言中簡化並增強您的電子郵件通訊。,ofmanmcabclefldfoofnpbmddeadochi,Raply.AI - ChatGPT Email Assistant AI
RoboForm 透過記住密碼和自動登入網站讓您的生活更輕鬆、更方便,pnlccmojcmeohlpggmfnbbiapkmbliob,RoboForm 密碼管理器
全功能二維碼擴展（The Quick QR Code）：二維碼生成、攝像頭解碼、截屏解碼、圖片解碼、長短鏈接相互轉換、歷史記錄等諸多功能。,eefoinodjigoedmfjkbikmdhecggljgc,極速二維碼-多場景解碼工具
Chuck Anderson 是藝術家與設計師，來自美國伊利諾州芝加哥，現居於密西根州的 Grand Rapids。他的作品皆是透過 NoPattern 這個品牌推出，合作客戶包括 Vans、Reebok、Mountain…,gegkoiakifeoejnjkbnnojkkdoegeofp,Chuck Anderson
Chrome離線QR碼應用程式（The QR Extension）：一鍵點擊，為URL、文本及手機號等內容生成離線QR碼。,dochhbdlcilmpbijaboholgkcgpljdpi,QR碼應用程式（The QR Extension）
將網頁轉換成 Foxit PDF,cifnddnffldieaamihfkhkdgnbhfmaci,Foxit PDF Creator
在新分頁隨機顯示新的桌布,fbbdincgjgdmbbkongmineooghpadbgk,分頁壁紙君
My Hero Academia Boku No 1920X1080,lflhjdkocmlkdncbpgahcppjbcjdihfb,My Hero Academia Boku No 1920X1080
專門為教育、科研、遊戲、新聞、外貿、跨境電商、海淘及開發人員服務，解決ChatGPT無法下載以及上網加速工具，Chrome內核瀏覽器專用，同時可以訪問GPT-4、DALL.E2、Whisper、Alignment、以及API等OpenAI旗下產品。,leeenhhfhgbbohpaiogpfllclaoapoki,CG Download Master - ChatGPT download tool
用我們的繪圖工具來繪製函數、探討等式與繪製資料,ajijpokmmljpgdacmnejdjkbjjpjjekj,GeoGebra 繪圖計算機
free tv shows with good quality,hgjlpfbjgpcbpnfabnhpbbomogiafalj,Tv Online HD and 4K
在線著色，繪畫比賽為所有年齡段的孩子，自由，樂趣，教育和容易發揮。,lfcihoakknfkjcknladbmbnohciigehd,繪畫比賽
Anchor - Share URL with specific text.,ollnkkhehcdmbolgcccccjadenipenic,Anchor
BlockZilla 在 Facebook、Twitter、Reddit 等主要網站上隱藏推廣推文、贊助帖子和廣告。,lopgldindmdepmbimbmakmcgahdifmip,BlockZilla - 隱藏贊助的帖子和推文
Hunter X Hunter 1366x768,hkpmdeidpmhghanhkichpcmeoejbmilp,Hunter X Hunter 1366x768
League of Legends Ahri 1366x768,okjjjidleiebblpnanjdmklicjbabplh,League of Legends Ahri 1366x768
An Recoder for tab,pnghoipanfcobckmlilgelhbfpkckefg,AvaRecorder
带图像的假推文生成器可帮助您生成假推文并将其作为屏幕截图下载。,abbhidihhhifkempcodlfljffaigfoip,假 Twitter 截图生成器
Make niconico douga comments transparent 👻,lhmlelhjodacloolefifbnolbjnolhnl,Niconico comment transparentizer
AI助手由GPT-4驅動。無論是聊天還是管理個人提示，一鍵處理選定的文本等等，應有盡有。,befflofjcniongenjmbkgkoljhgliihe,TinaMind - 基於人工智能的助手！
單人調平宋金宇陰影壁紙擴展程序重新定義了您的Chrome新標籤頁成為單人調平宋金宇陰影的背景壁紙。單人調平宋金宇陰影粉絲的主題。,hlgiogmnihnlhhajegpfogfdnejemgaa,單人調平宋金宇陰影壁紙高清
忘掉您的密碼吧，不要猶豫。有了 True Key 應用程式，您本人就是密碼。,cpaibbcbodhimfnjnakiidgbpiehfgci,True Key™ by McAfee
顯示隱藏的噗浪表情。,aomdjjfldjbbnojlonpahdajglndlomc,Plurk-Smile
增加和放大您的最大音量。,idopgohiahjbghjonajlnalffdalbmin,Sound Booster
迷宮傾斜球是一個最佳的平衡的保齡球的冒險遊戲。,ojoommmamnnnmdjpgilljjofhedfhfbb,迷宮傾斜球
"Search Justdial for listings, scrape names, addresses, phone numbers and additional details instantly. Export data with the click…",ccnfadfagdjnaehnpgceocdgajgieinn,Justdial Extractor - Justdial Scraper
Final Fantasy StormBlood wallpapers bring your chrome a new look and useful tools,bbjafcjmegfefhlhkcanahpomdcmmibn,Final Fantasy StormBlood Wallpapers
彈出窗口中的好遊戲，可以消磨您的時間。,ihhbmpkjdilkmlcdbmcelkipfijepnji,打磚塊經典
對中文關閉「依書寫文字決定字體」的功能，讓中文字變好看。,lndmkajeoopejggihiomoaepinlhblmm,不要給我亂改字體！
Om deze toepassing en alle functies te gebruiken moet u een Synology NAS hebben en de laatste versie van Surveillance Station 8.0…,jmolngjbgpidleeaajjofoihpejaclif,DS cam
"Auto refresh for web pages - multiple timers, works automatically",lgjmjfjpldlhbaeinfjbgokoakpjglbn,Amazing Auto Refresh
Ghostery是一個強效的隱私擴增功能。攔截廣告、制止追蹤器及加快網頁運行。,mlomiejdfkolichcflejclcbmpeaniij,Ghostery – 隱私廣告攔截器
在瀏覽器中保存複製文本的歷史記錄。,hocnnmhgcikjadmcgimjfabidalgejio,剪貼板歷史
AIX智能下載器可高效實現網頁圖片，視頻，音頻等內容的嗅探和下載，同時擴展集成多個網站的智能腳本，快速提取你想要的內容。,ibdfeimkglcmdejppabkaidpippniiob,AIX智能下載器(圖片/視頻/音樂/文檔)
Drive Mad is best simulation game you can play on Chrome™! Offline and Popup!,eeiaaffboagpdcjigimhihngjglpbkgg,Drive Mad - Drive Mad Unblocked
转换长度单位，重量，体积，面积的单位为亩，平方米，温度和时间。,fbiicdapcioonpclifmhmcnhhdegnpke,Unit Converter
A bell will ring every 15 minutes or randomly just to drag you back into here and now,aopdhjpgkecddgikmahfemkopadamhhd,Mindfulness: Drag you back into here and now
重新啟用Web Developer™的右鍵,jphmhjnbddakinkhgollokhgbcgihgan,為Web Developer™啟用右鍵
"Jeunesse Global 美商婕斯

LUMINESCE系列 Google Chrome 主題背景! 

LUMINESCE™ 背後的動力…",enldadngmmjllplfebajfkhfhlgmmkkj,Jeunesse
一款支持超過 100 種語言的 Telegram 消息自動翻譯工具(非官方),lbjcgpijhkhnlnfjjdoipaknjnpnnmae,自動Telegram翻譯器
"Free Simple tool for high quality video capturing from Tab, Area of the page and full Screen, with Mic, Webcam and System audio",jdopnakmnlnccgpfpmjmdjjohmcdgabp,Screen Recorder
Sync your bookmarks privately across browsers and devices,fnaicdffflnofjppbagibeoednhnbjhg,floccus bookmarks sync
"Premium WA Bulk Message Sender - Send Whatsapp Messages, Attachments, Personalized Message | Software | Marketing | WAMessager",afgbckekjlfkfhklldgdndiagddhbohm,WA Bulk Message Sender - WAMessager
Captura Leads a partir dos locais do Google Maps,belcijebbclhglnfiopddgghmcklkkgj,Lopix - Gmaps Leads
計算輸入窗,pbjjdpghnkambgpamkniafmiiedmjaff,計算輸入窗
League of Legends Lee Sin 1920X1080,pbodchhhjgjaghelilnjengmbbalmloe,League of Legends Lee Sin 1920X1080
League of Legends Yasuo 1366x768,kpngaapabjegfledjogamobkcbneijle,League of Legends Yasuo 1366x768
AI Copilot 可以回答截图查询并协助写作、总结、翻译和语法检查。,hajphibbdloomfdkeoejchiikjggnaif,QuestionAI 作業 GPT4 動力 AI 助手
解决谷歌翻译在中国大陆无法使用问题，修复Chrome内核浏览器的网页翻译问题，整页翻译/划词翻译/文本翻译/截图翻译/翻译发音,fjkpgkefceopkogemcjcnncdhbgldolm,谷歌翻译助手
Translate between languages using features like text translator. Translate all is a language translation expert.,gpdfpljioapjogbnlpmganakfjcemifk,Translate All Languages - Translate what you read or write
"Simple note sidebar which can be used to write a note, record thoughts, to-do list, meeting notes, etc.",emiochiflnnegkecnjndifbobmbepdne,Note Sidebar
Google Chrome™ 的货币转换器快速且易于使用。,lchbildgigopnmaigadjppidkpeenief,货币换算 for Google Chrome™
"讓使用者瀏覽質譜檔案, 並且上傳特徵代碼至Acromass Database分析出質譜內容",iahomdoglmnihcbhmejfdajbfeeclcjl,Acromass Classify Probability
電力別動隊場比賽中他們有許多顏色，但他們一起是一體的。發揮你最喜歡的電力別動隊遊戲！,feiolihlibkbeaghnhelepbpcolkhlnf,電力別動隊遊戲
The Fake News Terminator,cpmofdbobhemoodifnhffdodkkfkemai,TruSign
怪物凍結了鳥類的洞穴。幫助他們逃脫！,nkghoiljibekjmmeehnifmmjhgkagddd,Unfreeze Me
"Act Piano turns MIDI songs into notes and sheet music. 
Learn to play piano interactively with sheet music and piano keyboard.…",oplogehodgjoccedjeappnckpcppbbma,Act Piano
(在不同的頁面、視窗及程式間觀看影片),gcfcmfbcpibcjmcinnimklngkpkkcing,Always Video ᴴᴷ - 測試版 ( 自動畫中畫 )
Integration powered by NEXTGEN,aopbaakgclifnjkdknaiddgpanpcbmgg,NEXTGEN Click to Call
網頁圖片下載保存工具，小樂圖客-簡潔版，支持一鍵批量下載圖片，截圖，拼圖，畫圖，美圖。超級用戶，請使用極客版,bedbigoemkinkepgmcmgnapjcahnedmn,小樂圖客-簡潔版(ZIG Lite)
Obaxa barcode cashback app lets you scan barcodes and gives you automatic access to up to 52% of cashback. Our database contains…,iddgflpjjghalkihmkikefcideocfgae,Obaxa
Maysie是為您而設的時裝搜尋引擎，讓您可以輕鬆找尋及比較來自不同品牌的最新時裝產品。,hjiedgakjcpldomkkibdcofgggcipian,Maysie
Mother's Day 1920X1080,hnjfemigaodjfgfhaeceijbolihchggj,Mother's Day 1920X1080
Fairy Tail 1366x768,eghclfcligdkpdaobccoghgcpbcgnipn,Fairy Tail 1366x768
"Free memory game for kids and adults with vegetables, foods, drinks, milk ...

.Photo Memory Game is a game for everyone, preschool…",lacpkckcceedifilfohnboammhgnhbaj,Tereza Graphics Memory Game
自由！自動播放下一集，速度控制，跳過標題序列並蒐索3000多種類型！,ojeagliladediodhljoaiieahplfchef,Netflix改進了免費！
Integration powered by InBound Call Support,bjheppcpkjgdeelgacglekkbkbkngoam,InBound Call Support
允許您的網絡攝像頭和桌面錄製屏幕,aloeieipaodpomkchfojicbelpcglnep,免費屏幕錄音機
壹個方便改變網頁外觀的擴展,oiaejidbmkiecgbjeifoejpgmdaleoha,Stylebot
Calm Nature Earth day Ultra HD 1920x1080,ocglkkmkoihhehajdfgkfmlheieokfcb,Calm Nature Earth day Ultra HD 1920x1080
倒數計時你的國軍登出時間及百分比,ohhjaooiggljialikmgocalhibeglhdh,國軍ONLINE倒數器
"Descripción
Virtuapos el TPV POS virtual , es una aplicación Profesional de Terminal Punto de Venta o (Point Of Sale) Táctil, para…",ecbhlcfmojpcmabcnoidbgppkcjpgkkh,Virtuapos
"Applicatie dient gebruikt te worden in samenwerking met Exquise Next Generation om patiënten digitaal aan te melden. 
Verandert…",jdnfkbfcgkaglfefhfkcpmkonifacnmi,Aanmeld Functie
自由！在Gmail中添加所有電子郵件的發件人圖標和網站地址。,ejoemdaeibijipebhioidecijfbndocj,Gmail的圖標
Sync from Google Bookmarks,dhkeiaaimpifdppinlokmgolcnnnlnfa,非官方谷歌書籤
Control Fliprobot J1100.,cnpfjgdoeiojflnogedflgfkpepiaced,RAS_Lite1.0
您需要的任何地方的浮動科學計算器,mbfnbhfjnjeedaknilkfegfnnmmmmpmn,浮動科學計算器
用YouTube字幕學習語言,oghhiiieljkjlkiednhchfbpbgadkeam,CaptionPop
凍結標簽頁,opmcmbcmkbobnbloaanbgminfokciinp,Tab Freezer
Reliable adblocker of video ads for Youtube™,ijelnahiojlfbmiihbmgkaldffppfelp,Adblock for Youtube™
將 MSN 設定為首頁，並將 Bing 設定為搜尋引擎,midiombanaceofjhodpdibeppmnamfcj,MSN 首頁和 Bing 搜尋引擎
自定義你的新分頁，現已適配移動端瀏覽器，包括Kiwi瀏覽器，狐猴瀏覽器等,pdfladlchakneeclhmpoboohikpbchkj,Infinity 新分頁移動版
使用 Jio Cinema Watch Party 与朋友同步观看 Jio Cinema,pjjojfjmefckejekdniilmdjjddkddpe,Jio 影院派对
Automatically admit join requests from external guests to Google Meet,epemkdedgaoeeobdjmkmhhhbjemckmgb,Auto Admit for Google Meet
Cute Trolls 1366x768,jhfdhibahffkdolbnalbhkhkalffiamh,Cute Trolls 1366x768
以Chrome擴展程式的形式玩2048 Doge - 也可以在沒有網路的情況下遊玩，現在來試試看吧！,nelclcnompoipnjlkcejmfakcplbijgj,2048 Doge 請求 Chrome 版本
"This tone generator app produces a continuous tone. The user can modify both the frequency (~pitch) (0 - 20,000 Hz) and the…",kiopjbpjkcgeajcflgpnkjobpljodkhk,Physics Toolbox Tone Generator
為 Web 應用程式啟用HCL OneTest™ UI - Web UI 支援,lenenjceohajnkampdkfnbjimimbgbmn,HCL OneTest™ UI - Web UI
