description,id,name
,hechocobhafbgofofbpeacckfmfgdfnl,Sweet
Add extra functions to the Vend/Lightspeed back office functions,lmpkdellflhinbminogihankjmpbicjg,Vextend Office - Simplify Vend/Lightspeed
UBuy.com.vn - Order Tool,ncldckdbdcnldikkenolamhgkcppdjpo,UBuy.com.vn Order Tool
A decentralised like button.,cgpmaldjmbpieenobjmjpokdjfihhple,LikeButton.eth
YouTube™ Video Ad Punisher / Blocker automatically skips YouTube™ video ads and spams spammers back!,moebapoecfbnbdjdiaohahogheghnida,YouTube™ Video Ad Punisher / Blocker
Koala Inspector For Shopify - Spy Tool For Dropshipping & Shopify,hjbfbllnfhppnhjdhhbmjabikmkfekgf,Koala Inspector - Shopify & Dropship Spy Tool
This extension creates a trello card whose title that of the current tab with a shortened url of the page in the description.,gcdgongcgfoihmhkohnjieejppbgoanc,Tabs for Trello
,cnjjmkmhpepflkjnkkopmfbfdcphlbie,Cute Anime Girl theme  1920x1080
Автошкола Киев - лучшие предложения по урокам вождения в городе Киев,fggkemdmoomafcibcabogkfodgihgpnc,Автошколы Столицы - автошкола Киев
Awesome theme for Atavi.com,dfdljcobejidnahnogmafocfflajmnde,Biker
"This is kiosk app to use KLIB - OPAC Web at KIS International School

- ICT Department",akggiagadpaijeaokbmjaanefdjmbaag,KLIB
Track unfollowers on github.,laplemhfnkmmijhemgamafcbchgoddgp,Github Tracker
This is a theme made on the app Harmony.,cmhjaompjhjgdlipnjjgggfokcinhfob,Black and White Wavy Web
Save money and earn rewards when you shop online.,bmnlcjabgnpnenekpadlanbbkooimhnj,Honey: Automatic Coupons & Rewards
Copart/IAAI sites action recorder and account manager,lhjoljmdbapmjlipeonmhobdlnjpmdad,Global Logistics Extension
"A dictionary chrome extension that allows find definitions, examples, phonetics and Pronunciations of a word without opening any…",aekobffhjbgfmedffklgcjdhjlpmgclf,Words Dic
Unofficial tools for CubingTime.,odhkljnldimmcmflodmlcnclgjbnlcfi,CubingTime Tools
Best Loop Tool. Works with all websites! Move your mouse cursor over any video and set loop in a portion/range.,hlnfnoahfgnjnbkdckfnolacbmoknlmi,Looper
Seamless unit conversion for GoodEggs.com,neifcoahbggpdocigdifgepmjclcaadk,Apples to Apples: Best Prices on Good Eggs
"Math lesson app for teaching properties of powers. Video instruction, worked examples, guided practice, and instructor notes.",ooakcibmbncfhclpbhgjomclacachcih,Guzinta Math: Powers and Exponents
Adds magnet links to torrent files on Torrentz.,pgmaidhfoodebfiocgananbdfnankehm,Magnet Links for Torrentz
Share your secrets securely with sesaam.app,bpmhhhffcfhmlljbhjlhgbekflnoejpc,sesaam
Simple support to create calendar events,lfgjicnpmcakigilbifjfkbegibpmkcl,Calendar Helper
"Battlefield 4 Storm Theme For Chrome - This Theme Is Free To Download & Comes With Free Lifetime Updates... 

•CHROME THEMES  ->-…",lljnfplnhjhemmgihlgafobnebpldbjo,Battlefield 4 Storm
Some background photos while listening to the radio,jjlknjpnokeohlchpcidagoiibmiipap,Radio&Photos
독서 장애인을 위한 읽어주는 전자책 뷰어,mghbhobcghaabgmgadiihlkhlemndjdm,Accessible EPUB Viewer
"Ninja VPN, a VPN extension for Google Chrome. Access any restricted website and remain anonymous using our proxy service",apbcbecdpjefgklcokinpapmmdekecah,Ninja VPN: Secure Proxy & VPN
Scan your NFT assets.,eoepooeledpjaoehhokhalpmlmjbedhe,Nifty Scanner
"This theme is based on a book page image. The new watermark is made by Ale herself! She made it with photopea.com!

I make my…",hejgmnlbnapfdholloocehjgcognkehm,Bookshelf 1
Tooly is a chrome extension that aims to add a quality of life upgrade to the user on a daily basis.,lmifmfggmemdennodakakednmfaeibei,Tooly
Set a desired speaker volume level for current tab in browser,gpgcdidnndfodoomilhdebefjknhmnek,Volumes Booster
Chiplot is a search engine for electronic parts for those who want to find and compare prices for electronic components quickly.,bdklgjfoadgllijcmfdkkedjhbiabcom,Chiplot : Electronic Components
Converts textual date times into status coloured icons with relative remaining time.,oglmfdjlhbpjocckabepgfnplpfclgdb,Performset (Zendesk) - Next SLA Breach
A Chrome extension that exports ChatGPT chat history as Markdown text,dloobgjjpoohngalnjepgdggjeempdec,ChatGPT to Markdown
Grow a little buddy by feeding him carrots.,mkcjolkgnlgmcpfhiiolbkknmfmbhoep,Lil Bud
"Easy Access to Karthick's Various Social Profiles.
Karthick is currently a 3rd year undergraduate student doing Computer…",lfpgobhafenlmieopdfhkegdmfjmbnfa,Karthick Social
Best fit theme for 1920*1080 Blue Lake Mountain Reflection Scenic Sky,ogmjpmgamfhgggihlgoededopnmbfdda,Blue Lake Mountain Reflection
"Find virtually all homes for sale from the Minnesota MLS using our IDX. Edina, Minneapolis & Twin Cities. Free search. Add to Chrome",igdpoijgibddmgmkbmjjmdjnfggbofjj,Minneapolis Homes For Sale
Aaron Paul Bryan Cranston Breaking Bad Walter White Jesse Pinkman Desktop Wallpaper Hot Fuzz Film Actor Television facial…,iofajjblaegmeaifmpiledaamkaogooj,Kill Bill: Volume 1 O-Ren Ishii Lucy Liu Bill
باستخدام هذه الأداة، يمكنك إنشاء نقوش متحركة عبر الإنترنت,hajjgmcmbpkinpjnehlkceifomlcfjcp,مولد العفريت على الانترنت
Fight Climate Change every time you open a new app!,ncjlfobccanbhkedphdahcemkpdfgpng,NuTab
Helps students learning Mandarin Chinese by displaying traditional characters with the associated pinyin and English.,aimjncnbfplnhfpemfbiicldecjocino,Mandarin flashcards
Capture full-screen,bokcjdlimoececpdmfcmijoabbcgoopc,OJO TALK Screen Capturing
Doodle Jump! Jump and break your records!,goiejopegncpjmocklmfiipofdbkhpic,Doodle Jump Ninja
Staff AUP so users can change there AD password.,hdlppeeffnegckmeobjfbkcogdlaeamh,OKCPS Staff AUP 2.0
"If you like this theme, will rate it, please. Website: https://gctheme.store/",dilihijdiloelojdcmemmkejgloigfmp,Many hoops
,ejbcajbkacjmnklcpfhgalgnlpdkfpea,Social Security Express
Тільки найкращі та найпопулярніші теми від сервісу Atavi.com,honlekieknpckcildgmlifkkhonanjac,Hexagons
Doodle Jump! Jump and break your records!,goiejopegncpjmocklmfiipofdbkhpic,Doodle Jump Ninja
Spinner.io wallpapers bring your chrome a new look and useful tools,nbnckkbjdfhmplfcenmbeiehaaeclfpa,Spinner.io Wallpapers and New Tab
透過您的 Google 定位紀錄比對您與確診者的足跡,pijapfpmfkbplhagkoiehcbmkgocjmec,台灣新冠疫情足跡比對
............................,immdeddgjijbkpdmkmhkpahpehaabhid,Eshi 100-Nin Ten
自動將 Reddit 的新佈局重定向到舊佈局的 Chrome 擴展。,jibebahneocebfgjlakmmlehilfebkpn,Old Reddit Forever
小組行事曆 • 甘特圖 • 專案時間軸 • 組合管理 • 同步處理 Google 日曆 • 時間追蹤 • 每日待辦事項清單,kkgaechmpjgbojahkofamdjkaklgbdkc,Trello 專用行事曆和追蹤程式
"Now you can play Rolling Ball - Unblock Ball right on Chrome™ Browser! Offline and Popup Version, without internet required!",eliolchggngdlkjdimahohollgljefmd,Rolling Ball - Unblock Ball
"See, hear, and learn from the free Holy Bible. With multiple versions of all of your favorite Bibles, you have on-the-go access to…",panmdnffckocjeceblimhdofgmobmeba,Holy Bible
"Tubes And Birds is an arcade game where you control a little bird.

Tap the screen to swing your wings. Avoid pipes and other…",oeddgnffdnabpdjlfonjaijpjboklfmb,Tubes And Birds
Simple android game with road signs. Do you want your children to know road signs ? The most commonly used traffic signs with label…,aglcgngibccbolgoajjpoabggehncmao,Traffic signs for kids
在您的Google Chrome™上播放經典的Flappy Bird遊戲離線版本！,ajdackonegjjllfgafjegebnolcbmgck,Google Chrome™離線版Flappy Bird
"VPN for Facebook - get online safely, anonymously and accessibility. VPN extension to access any website.",epeigjgefhajkiiallmfblgglmdbhfab,VPN for Facebook
League of Legends Lee Sin 1366x768,podkkcjbgokabeacahakmcgnmpcgofhe,League of Legends Lee Sin 1366x768
添加一個按鈕以在Google Meet™中使用網格佈局。,mgbmfbimbcffegjaagiolbjpfbepjogk,Google Meet™的網格視圖
Lighted 一按即買令你購買更寫意，只需輕輕一按，隨時購買心水貨品。,iflaagijgkfaefjobncjaafeookcgool,Lighted 一按即買
接管浏览器的新标签页设置，转为打开一个可以随意修改的网址,cglpcedifkgalfdklahhcchnjepcckfn,新标签页修改器
Play Streetball game,fadccimbhachadbhehhcljbkdfcalmpk,Play Streetball game
作為 Chrome 擴充功能玩 Tunnel Rush Unblocked 遊戲 - 也可以在沒有網路的情況下玩，立即嘗試！,foehhmbokjmakemkincfkhkfhdpoohii,隧道衝刺暢通遊戲
Lyricist.ai 靈魂寫手，透過 AI 生成歌詞和文案，是作詞人、文案小編和文字工作者的神級創作小幫手！,gebbjfcolnpbpgddaabblkonfggpemah,Lyricist.ai
您可以將網路上的任何內容儲存到 OneNote。只要將所需內容剪輯到 OneNote，您就能進行整理及編輯，並從任何裝置存取您的剪輯。,gojbdfnpnhogfdgjbigejoaolejmgdhk,OneNote Web Clipper
在Aliexpress上按圖搜索商品,kafhoidinlbamepifokmbjdkkciefhgh,在Aliexpress上按圖搜索
修改網站的默認編碼,oenllhgkiiljibhfagbfogdbchhdchml,Charset
Snake game (Anime Girls in background) for the browser. You can play directly in the popup window,jgmkfcekmdlnfgcneihgpnmpemleiooe,BMW Snake Game in popup
Get full screenshot of the web page,fniobaamocffdlfnpdniiimnoihmjbkn,Full screenshot
Qsirch小幫手將可以幫您快速找到您NAS上的檔案。,ipocdfgahhjaigldllakopnkofpcpahn,Qsirch小幫手
「時間的歌」專屬播放器，開啟新分頁就能聽見時間的歌，在背景中陪伴你每日的工作。,ibpliiiaiibhhnehejjhgoippcobeldg,時間的歌
Aopen chrome app,dagknmalpkfjjjpkdnlohgdobfcdgman,Aopen chrome app
"Sign language for beginners helps you understand sign language easily.
Sign language for beginners is an app specially created to…",emdomeobcjkbfdemfefgnfcjcabnmpai,Sign Language For Beginners
YouTube留言彈幕,ldlogbmoofpmjhkccjhajjkkkjojenip,Bulletchat for YouTube
Chrome™的自定义光标。 使用大量免费游标或上传自己的游标。,ogdlpmhglpejoiomcodnpjnfgcpmgale,Custom Cursor for Chrome™ - 自定义光标
一款線上高效辦公工具，擁有近300款工具包括視頻工具、音訊工具、圖片工具、文檔處理、檔案轉換、辦公輔助、設計工具等等,fnlomhffjgaiejopfbacfjjpnegclmfb,即時工具-即用即走型線上全能工具箱
Find a Job - Job Search - Job Finder,ghclpimmbjepihhlnklkiemncamklkii,Find a Job
可愛的狗新標籤壁紙和遊戲，專為可愛的狗迷創建。用一個很酷的可愛狗新標籤更改您的標籤。,iaaplcnlmmnknnbhhpedcaiiohdepiok,可愛的狗壁紙高清自定義新標籤
Simple and useful notes that sync with Google Drive. Keep sticky thoughts in notes. Keep notes in Google Drive. Keep your mind calm.,ndidogegapfaolpcebadjknkdlladffa,Notes: Keep Sticky Thoughts in Google Drive
Gmail Notifier - gmail notification tool,limaaifmadohceoiadbmpdoiepcpopfd,Gmail Notifier - gmail notification tool
Auto replace chinese to english in dictionary,ndpklnlelgdfcipfglcldcmkdejogklp,ChromeReplace
"Screen Pop, Click to Dial",cepdaokljebeocbognhhdffnddjfnofg,SimplicityVoIP
"<b>Lines</b> is a new puzzle game. It’s easy to grasp and very addictive. Make horizontal, vertical, diagonal rows or specific…",hiedllljkkffebldfmaipfhdofgckeol,Lines
簡易文章分析工具,jdiobgpadklegdfhfbanebmlpalaeche,PTT 鄉民樂 - 文章分析小工具
中文輸入法-筆順碼,ncjhkkjlkcnlehiceboccopicedlcbhb,BSM (筆順碼)
一個簡單看股票的小工具,kdfomaiafhgjpidlcfhfpifmleaiacji,yStock
我真的不想再打字了,gacgildcphkglggndmdehplpjmgfgjnk,LazyGPT
免費的AI視頻腳生成器，可根據TikTok視頻字幕和關鍵詞重寫，寫稿效率提高了10倍。,fhbibaofbmghcofnficlmfaoobacbnlm,TikTok短視頻腳本生成器 - 在線免費的AI寫稿神器
保護你的瀏覽器，免受病毒，惡意軟件的侵犯！,bfpoaihndjklkeidejbgjaadeidhfenm,Chrome 安全保鏢
"Ask questions about dialogue and expressions used in movies and TV series to the native speakers, with just one click.",nlfckkicjjjkhmfjofoglcffaenpiojl,HiNative for Netflix
可以让用户方便地获取二次验证的验证码,aikcihjoejmbpjbfdianeooembekikjn,两步验证(Authentication) - 2FA
League of Legends Ahri 1366x768,hcgdinpjbbcjpichekcdmapeehcohfln,League of Legends Ahri 1366x768
"Through a serial communication port, this APP is used to talk with 
our 328eforth on the Atmega328p cpu chip of an Arduino UNO…",dkbgcfcjbajlpblohlndijcdnhkfjcck,TTY for eforth
Maximize Sound: Amplify Volume by 500% with Super Volume Booster,ahddimnokcichfhgpibgbgofheobffkb,Super Volume Booster
Refresh identified tabs of the current browser window automatically.,decaoenopoahbdpmpmkmmgfmgcaadpee,refresh-it
"This is a theme inspired by the beautiful big cats with stripes =) 
Black and transparent tabs and black toolbar and a huge…",jeocielkljeljlhgmilgcokbdapgdcio,Tiger theme
暗殺教室壁紙擴展程序重新定義了您的Chrome新標籤頁成為暗殺教室的背景壁紙。暗殺教室粉絲的主題。,pjkelemkphacpameembgifbckeidaopd,暗殺教室壁紙高清
為 Google Tasks 側邊欄工具啟用全屏模式的 Chrome 擴展。,ghilejjfmnclbgidlapclmdjbficfhnm,Google Tasks™ 的全屏編輯
"管理你的下載快速通道。是你的方便、快捷、高效的工具！媒體資源探測: 視頻(mp4, avi, asf, mpg等), 音頻(mp3, wav等), 圖片等",gokgophibdidjjpildcdbfpmcahilaaf,下載+
Over 1873 Styles and Custom Cursors for Chrome Browser via free extension Cute Cursors. Enjoy Now!,kdnmnhneccackiehedjmnpgfpjicicgo,Custom Cursor for Chrome™ - CUTE➤
簡單易用的書籤管理器,poefceffmekhjoadknillcbdifahongk,Ease Bookmarks
This extension will help you quickly export or save Instagram comments to XLS/CSV file.,afkkaodiebbdbneecpjnfhiinjegddco,export instagram comments
用Presenter輕鬆捕捉IPEVO實物攝影機拍攝的畫面，讓你的教學事半功倍。,jjehhjdfaodpjfkmcghhppkdcpoboekn,愛比 IPEVO Presenter
從Instagram將任何照片，視頻和故事下載到計算機,fhllildlikmifjkoejmohabfddmndphf,從instagram下載照片
在來自 Google、Bing、Yahoo 等的搜索引擎結果旁邊顯示 ChatGPT 的響應。 彈出窗口上的 ChatGPT。,jlbpahgopcmomkgegpbmopfodolajhbl,用於搜索的 ChatGPT
God Of War 1920X1080,kkdkhmmbadeihdfbbgnmiojfajnibmgh,God Of War 1920X1080
Integration powered by JetWave CRM Plus,idfnfcohcccmgedocmmegpldokpdlmli,JetWave CRM Plus
Smart. Simple. Beautiful Theme.,pkagljjfcjjpbkkfppbklhamjlodpnpi,Slinky 丰富多彩
Bid tool 競標工具,nfaljdpaaadklbkfebiminkeomjncfpc,Bidtool Extension
以 Chrome 擴充功能玩 Monkey Mart 原創解鎖遊戲 - 也可以在沒有網路的情況下玩，立即嘗試！,lnddkepncjbefikblkaiccdlmoimholm,猴子瑪特原創遊戲
此擴充套件使用時須搭配 SmartPKI 多憑證安控模組(需要額外安裝) 版權所有: 展信資訊有限公司,jhffgcfmcckgmioipfnmbannkpncfipo,SmartPKI 多憑證安控模組擴充套件
Death Note  1920X1080,fmnmanbhagahflamaimalckfogfammib,Death Note  1920X1080
"Play Lightning Speed Cars Racing right on Chrome™ Browser! Offline and Popup Version, without internet required!",appkniameblbolellemmflkkkohdoegp,Lightning Speed Cars Racing
Attack On Titan Severity 1366x768,cocbpkinocejhcifiikopoodalaegelg,Attack On Titan Severity 1366x768
将ChatGPT的回应整合到搜索引擎结果中！适用于Google、Bing、Yahoo等。在弹出窗口中获取gpt-4的访问权限。,khdnaopfklkdcloiinccnaflffmfcioa,搜索引擎特色ChatGPT
ChatBot AI助手是一個能同時使用ChatGPT、Bing、Bard、Claude等多個機器人，能回答各種問題，包括翻譯、寫郵件、問答等,apknopgplijcepgmlncjhdcdjifhdmbo,ChatBot AI助手 - ChatGPT & Claude & Bard & Bing
Girls' Generation - Sunny Theme,ppmmkfnmgfgofcgodgjaeclehobfbfga,Sunny Theme
Tag text to create cards,nimohiamibbjcjbjemndjcbljlmolodl,Tag-to-Card Editor
使用簡單的繪圖工具在任何網站上繪圖，然後打印結果。,efifccmcdofkcjcleapkaeedlhcejcmd,適用於Google Chrome™的Web Paint
Language Learning with Netflix & YouTube Extension - App for Language (AFL),bekopgepchoeepdmokgkpkfhegkeohbl,Language Learning with Netflix & YouTube-AFL
"Hola ad remover is a free adblocker that blocks annoying ads, malware and tracking..",lalfpjdbhpmnhfofkckdpkljeilmogfl,Hola ad remover
"Now you can play Hyper Maria Rush - Unblocked Games right on Chrome™ Browser! Offline and Popup Version, without internet required!",pnjpegemblalbkpielaipenadfedgegm,Hyper Maria Rush - Unblocked Games
"With this app you can take a floorplan of your house, set the location of a WiFi router, and simulate how the electromagnetic waves…",jgkakaecbdoedmgpfelanndgnnmcomom,WiFi Solver
Lets you copy Jira issue ID.,pkhafgkgndfilihcamjpnchfclnbjknb,Copy Jira issue ID
很容易在眼睛上的紫色 YouTube 主題的陰影。,cnhegbhhhioemkpmmdhblaphnhojaadk,YouTube™ 的紫色
Reactivate Backspace Shortcut for Page Navigation with BackNav,epalebfbjkaahdmoaifelbgfpideadle,BackNav
簡單小巧的字典工具，圈選->右鍵點擊->查詢，pdf也適用。,nekdehphhapfjmpjghpcifeoaamppcnj,Little-Dictionary 小字典
BARON UEDA 是插畫家，以筆下人物極具特色的眼神而聞名。他精通色彩與空間的混合搭配，曾參與許多領域的影像創作工作，例如平面廣告、雜誌、網路、電視、時尚界與遊戲界。,jepnnclcabggchgbkogkjilobomklihn,BARON UEDA (FR/LAMEMONGER?)
快速查聽中文字的粵語（廣東話）讀音。,ejhdpdnlcanafgbeddddejapdkjamddf,粵讀
This is a test from our Android app.,kfiafbglkkgkdeefiajbnncljelpeafo,Hawkeye Football
最好的新標籤瀏覽器擴展，帶有 ChatGPT、書籤、日曆、待辦事項、新標籤主題、番茄鐘、RSS、邊欄、深色主題,cmfhopmhaagcfnjflfppceclmkenjkpc,帶有日曆和 ChatGPT 的終極新標籤
Hide unnecessary content in playone.,ijfnkcpbmnjaejoapkjbelpaolljgmli,Garbagetone
在各個搜索引擎中顯示ChatGPT的回答。適用於：Google、Bing、Yahoo等,pbeiddaffccibkippoefblnmjfmmdmne,用於搜索的 ChatGPT
書籤管理器與組織的幫助，跨瀏覽器和平台同步,pdcohkhhjbifkmpakaiopnllnddofbbn,書籤管理器快速撥號| Papaly
Virtual Backgrounds for Google Meet™,iiojpgfndaegfkmcdleandpjnkhmbmfj,Virtual Backgrounds for Google Meet™
高清攝像頭的應用：高清圖片打開你的攝像頭。圖片是支持高清攝像機HD。,jaknphafiecgijhicofjhlgmpkcfmgdo,高清攝像機
Quickly copy Cool Fonts from your browser.,cekcmmkjiikekhjkbkfhbgfpplcndefi,Cool Fonts
Vocaloid 1366x768,iknjbgjapdhndgnehfjfehoepfcdlkic,Vocaloid 1366x768
添加新词到字典中，他们会偶尔显示为卡。,ndbpgappknhobbikhmjenceoklpaalam,EachWord Translator - expand your vocabulary
Mariah Carey 是史上最成功的女藝人，也是美國告示牌 50年來百大單曲榜上唯一仍在發片的女歌手，且有可能打破披頭四長期保持的 20 首冠軍單曲的記錄。,eodbbhbmhfemocgkhhihfjnkifmcjmoi,Mariah Carey
扮演馬里奧的角色。原始的超級馬里奧遊戲在線瀏覽器中。隨時加入遊戲,pegfdldddiilihjahcpdehhhfcbibipg,超級馬里奧兄弟遊戲
Graphulator with Calculus,eimkcffdakecfnjnkcbefpndphkgmjah,Graphulator With Numerical Calculus
Quick access to EXIF data of any image you view,mmbhfeiddhndihdjeganjggkmjapkffm,EXIF Viewer Pro
協助計算Steam合卡獲利的擴充套件,fcjodomkmeimmpmhlnnpgjfjlpbnmohd,Steam Cards Helper
动画光标。 可爱的光标。 自定义光标。 从大量酷炫的光标中将鼠标光标更改为自定义光标，或上传您自己的光标。,gdcfjidbchfpojnfifkgghbamkdmbdaf,Sweezy Cursors ★ Chrome的自定義光標
Auto Scroll tool. Works with all websites!,kpfalbhnppkbokafignonoppegdndlch,Auto Scroll
是否想听一些朗讀給您的文字？,dpckcijgfoooohnnijhjcakkibbcmlje,文字轉語音
聰明！要快！爆炸他們！,cjaocphggdpanbnigjbpcclpgkodcpcc,Octopus Blast: 墨搶
Block Facebook™ sponsored and suggested posts in any language,njcnnfelhkehnacoabhefefkbmloakkf,F.Block Sponsored
Pocoyo 是一齣動畫，內容圍繞在一個喜愛玩耍的小男孩以及他的冒險事蹟上。Pocoyo 帶領兒童透過歡笑學習，並激發互動，藉此提升他們的創造力、自覺與自信。,japfmfedcmkpgmeddemocaoknbejknnm,Pocoyo
使用Gmail版Todoist管理郵件,clgenfnodoocmhnlnpknojdbjjnmecff,Gmail版Todoist
Dark Souls 1920X1080,nooohnknocoipkgjoaodgkomdepdgeag,Dark Souls 1920X1080
"Customize your Scrollbar easily, fast and however you want!",flffekjijpabhjgpoapooggncnmcjopa,Scrollbar Customizer
專門為教育、科研、遊戲、新聞、外貿、跨境電商、海淘及開發人員服務，解決ChatGPT無法無法登陸以及上網加速工具，Chrome內核瀏覽器專用，同時可以訪問GPT-4、DALL.E2、Whisper、Alignment、以及API等OpenAI旗下產品。,jldegcnebepbkcbibjgmjmkmachhkaka,CG No Login Master - ChatGPT無法登陸特殊工具
Smart. Simple. Beautiful Theme.,gcckgldbanlfkbiacmgbanilapghpihj,Slinky 燦爛
一款支持超過 100 種語言的 Twitch 消息自動翻譯工具(非官方),glikbmhlfgmnajdafpkhpeaccgjeimbc,自動 Twitch 翻譯器
星期五晚上Funkin壁紙擴展程序重新定義了您的Chrome新標籤頁成為星期五晚上Funkin的背景壁紙。星期五晚上Funkin粉絲的主題。,jnpcpagdkiglbjpifgpndcgcapghnbdp,星期五晚上Funkin壁紙高清
Validate the cryptocurrency exchange plotform,lneplflofmmmggjeihjafkddbbamheke,Exchange Validator
Integration powered by SimpleFiber,agamcmhllklgiamjeogggdepcjialjla,SimpleFiber
靈巧實用的彈出書籤管理器，NeatBookmarks的加強版,odhjcodnoebmndcihdedenkmdmklpihb,vBookmarks
嵌入影片至當前網頁,agckebdmdigefadfdchbobpdppfobdfe,Video Tab
Vocaloid 1366x768,bjcacfapjbkojjnbdmojlnjlcinlingm,Vocaloid 1366x768
安装 Netflix Party Chrome 扩展程序以与您的朋友同步观看 Netflix,djpbcgbfllffgmoedmonmjbaofikcnnc,网飞派对
Get answers to key questions about Science. Find just the answer you're looking for. Provides a Wiki Periodic Table.,jhoicmhhjijeeclecfnlochagnlpiakf,科學的問題。元素週期表
Integration powered by Mongotel,jepepbifahlaifnacnnijkoclhncnkak,Mongotel CRM Integrator
Pixelman生气了之后，他最后打败在的战斗在Minicas现在，他再次上升寻求报复对他的损失他收集了他的前任,hiladbglphldjhbfjfahkaajifpacheo,PixelMan战的复仇家
Fourth in the four-game ‘Reading Race’ series of reading apps from PLD Literacy & Learning.,edhfajlfcopjljiabipjllgmampebana,"Reading Race 1d: ar, ai LITE"
控制一切的按鈕！,ppmnkcnnoclkpbbckblofjbjepocnflo,Ultra Button
Save business listings from OpenStreetMap. Presto is a powerful way to generate leads,oilholdcmnjkebdhokhaamalceecjbip,Presto OSM lead extractor
Let your productivity run wild with a plethora of gadgets in every new tab,pmojnimmbgjjfaghhbpehbnmcphffepl,Gadgetly
Paris Eiffel Tower Love 1366x768,dgfokmagfkiijdgifcoaibbddibcfcnj,Paris Eiffel Tower Love 1366x768
"The popular find the difference game on Android is now available on Chromebook! This is the original CLASSIC EDITION.

Find It is a…",gnbhpkenielffkhojjfegpbfgflepfgb,Find It
您可以立即檢查互聯網速度,oponafnkoebfnadnlaimnpbkkcfhamoc,免費速度檢查
Candie 是以性感、大膽和輕鬆有趣著稱的代表性時尚品牌，永遠走在流行文化的最前端，因此都以當紅的名流人士擔任代言人。,ikpajebegeaajlacdbcfkinjjlhpoaih,Candies
Anita Kunz 是藝術家與插畫家，作品常見於《Rolling Stone》、《Time》和《The New Yorker》等雜誌，有時也會在世界各地的畫廊和美術館中展示。因為作品出色，她已贏得無數著名獎項，包括獲頒加拿大勳章，這是加拿大國民的最高榮譽。,gigikhkagnbccbjmlkoboncigbcghjie,Anita Kunz
Grow your Instagram Account Organically without getting BANNED!,gclafainfbkgaanilhldgonkijclcknf,IG Auto Follow-Unfollow
Mass Effect Andromeda 1920X1080,jchjanjapnihpgkjegladadigegcacki,Mass Effect Andromeda 1920X1080
"Files, Images, Links, Youtube, SoundClound. Collect and organize everything visually in one place.",ifnkgbaghkjafmddebbhbbojmkbgmncn,BeeCanvas
玩家和交易者的理想工具。RoPro 為 Roblox 添加了許多有用的功能。,adbacgifemdbhdkfppmeilbgppmhaobf,RoPro - 增強您的 Roblox 體驗
这个应用可以让用户在工具栏上便捷地打开一个微型浏览器，方便用户在不切换窗口的情况下进行网页操作。该应用的主要特点是使用方便、操作简单，让用户能够快速浏览网页内容并进行相关操作。,cmejcceciccnofbnekcfbcgdghcaohpa,便捷浏览器 - ToolBrowser
Build your own cps record.,dphepiflcbpgcjldbomodjehkcgjebkp,CPS Test - Check Click Per Second
,kaifdlkeaapaidhfgjiepjkoflkncndn,TestPublishInChromeStore_JoshChang
"He has a handy stretchy stick to move throughout his winter adventure, but needs your help to decide how far to stretch!",ocmbglodnmkcljocboijoemgceokifgg,Stick Panda Play Game
快速免費打開XML文件,legopflakafagikcpiapgnbokgkbejlk,XML查看器
此套件用於列印郵寄資訊，節省手寫流程，節省紙張，讓一張A4可以重複利用，其他詳情及更新歷史，請看網頁: http://bit.ly/2g5UXee,efompblomhogdgbdoohpkpcbnklhelii,郵寄小幫手
這款應用程式檢查是否你有強的私人資料保護和防止跟蹤你的網上活動。,pdabfienifkbhoihedcgeogidfmibmhp,Privacy Test
美國大卡車是如此更難停放比其他貨車。你準備好迎接挑戰？,dkmkhjpocdkalbigaepikekbkbdogllk,美國卡車
以圖搜同款找到Shein上的同款,fnlodpokkmdkbfdpndggldifechbglbf,AliPrice - Shein圖片搜索
