description,id,name
Alfi Adventure is a platformer adventure puzzle game.,mkonckdeijcimlecklibjbnapmhnbpji,Alfi Adventure Game
League of Legends Lee Sin 1920X1080,edickcciicdmpehckmkfbfofliffgdpg,League of Legends Lee Sin 1920X1080
快速使用文字搜尋圖片的工具。4xDev(4-x.tw),pnhglagljalmcafahjelopnccoagojcl,QSImage Tool
Set a desired speaker volume level for current tab in browser,gpgcdidnndfodoomilhdebefjknhmnek,Volumes Booster
打造自定义 AI 提示库,jjdnakkfjnnbbckhifcfchagnpofjffo,AI Prompt Genius
Lets see how you can save the Strawberries from these hungry worms. A strategy based game for everyone. With different levels worms…,iailbkpjinfofnfnohgomaemmfnjnnem,Save The Strawberries
Turn the lights back off and focus on the video. This is like a cinema experience when you begin watching your Youtube videos.,pgbihanplpcmckeoibedjmbpblbaeoai,Focus On The Video
League of Legends Ahri 1920X1080,hbilfiodnfmeemjcdoeoolaobnokaonl,League of Legends Ahri 1920X1080
rename files,gphaappoiobikcbliolidflenibkmhcd,Rename files
"Listen to live audio from over 5,300 police and fire scanners, weather radios, and amateur radio repeaters from around the world…",jjbemehcppedbkemmkkjkajbfpkajmcm,Scanner Radio
,olecaebebjbkmcnmobbdhgeicjfhidll,Twistoast
搜尋旅店並與所有的旅店預定網站進行比價。,edhjfkogkackbonhdaakdomibhiadili,Hoteloogle
讓您可以簡易的探索 Wikipedia,hdghceafmahkdiaoenecabpfokplecfi,Black Menu for Wikipedia
开发人员可以在网页中添加javascript代码。就像使用我们自己的代码自定义其他网站一样。,aggnfbkmhedkekjoplldenefbchaoiln,Website scripting
方便地進行簡體和繁體的轉換。適用於需要復制粘貼的場景，沒有任何臃腫的功能，十分輕便。,jckhapdbaoilnkbidodkhendklmfgjgc,簡繁轉化工具
Free download Pinterest video and image. And support batch download to a folder.,poomkmbickjilkojghldlelgjmgaabic,Pincase-Pinterest Video & Image Downloader
Auto scrape tons of WhatsApp group links to get WhatsApp group member's phone numbers.,fjbpmndkeboplpbppggkplldmfemhfdc,WAPP Group Link Generator
可疑新聞偵測器替你標示出消息來源不明確的關鍵字，例如【據了解】【據傳】【消息指出】。接下來的新聞可信度請自行判斷。,odeilkajklkkkpinpbahehibpobhfjim,可疑新聞偵測器
"Bulk videos downloader for Facebook, supports reels and videos",bdoijmcmedjehajfdfcipjpjlcckkmce,ESUIT | Bulk Videos Downloader for Facebook™
在Chrome上玩隧道突襲2未封鎖遊戲。隧道突襲2線上遊戲。專為隧道突襲2未封鎖的愛好者而創造。,phnfgbbaglaakcggggahgglflnjehadh,Tunnel Rush 2 解鎖遊戲
寶寶可以畢業，但是寶寶不說。,fminmeokihgimabckhgagkikdclempdm,畢業預警助手
YouTube 不間斷運行 沒有視頻暫停，沒有視頻廣告,opgenniblhhdkjigheleehipgeidionm,不停 Youtube™
在瀏覽器中體驗 1Password 的最佳方式。輕鬆登入網站、產生密碼和儲存安全資訊。,gejiddohjgogedgjnonbofjigllpkmbf,1Password Nightly - 密碼管理器
Download ads from FB Ad Library with one click. Save ads video and organize them.,niepmhdjjdggogblnljbdflekfohknmc,FB Ad Library Downloader - Save Ads
Add the best menu bar to get easy and fast access to all your useful browser options and internet products!,egclcjdpndeoioimlbbbmdhcaopnedkp,Proper Menubar for Google Chrome
"Now you can play Sling Ape Unblocked right on Chrome™ Browser! Offline and Popup Version, without internet required!",dbjacigmihlldmfiphnjjokglhmjkfff,Sling Ape Unblocked
CRM integration powered by Loup,eoeoddoidhpekjaphhinbjdaccnaclaj,metricCRMconnect
2023 Extract the Essence of Facebook Conversations with Ease: Export Nested Comments like Never Before!,mpfndbkbcmbacdjmphhfapdmjgpfkjmg,ESUIT | Group Members Extractor for Facebook™
提供電腦沒有日文鍵盤時，也可以輕鬆的輸入日文 http://project.kimx.info/2016/11/jk-keyboard.html,fgopbcebangdmfambaianpnflemikhjg,JK日語小鍵盤
"Export, store, and import SQL (Structured Query Language) data to edit and to check syntax",dibhmdjbfcjgpmbeapiedndbphopnplg,SQL Editor/Validation
Blast your way to fun with Bomberman Classic - the ultimate multiplayer browser game!,hlcfpgkgbdgjhnfdgaechkfiddkgnlkg,Bomberman Classic Game
提升 ChatGPT 網站的使用體驗，提供一些好用功能。像是自動從 URL 填入提示、在回應的地方出現自動提示按鈕、以及更多好用功能陸續推出。,fmijcafgekkphdijpclfgnjhchmiokgp,ChatGPT 萬能工具箱
使用我們免費的有趣效果用您的相機自拍。,bnakhoaonbhdmmgeomabfjmdmbninijj,適用於 Google Chrome™ 的網絡攝像頭
Knit Plotter是一個基於Web的編織工具，可讓您製作Fair Isle，絞線和嵌花編織的圖案！,pfeenapookpacnhhakoilppnmbohncml,針織圖案
"Now you can play Basketball Legends Unblocked right on Chrome™ Browser! Offline and Popup Version, without internet required!",cpbpeipmjeoddppkgppcokffdhoimjeb,Basketball Legends Unblocked
為 Chrome 使用者提供安全的企業列印服務。,egcmejiaapccophafhfalaelbfgojdjf,Micro Focus iPrint
Create your word cloud from your text file quickly from Google Drive or local computer.,ongfoebpkfpddbbocneekoefhcchpmjk,Word Cloud for Google Chrome™
點擊網頁內的超連結，並可以使用 Native Messaging 直接打開本地文件。,njacpndhhhiledgbfffdahoecjlakpne,點擊鏈接直接打開本地文件
聰明！要快！爆炸他們！,ljnehaiegnblmdpjndhdfjpnllakladb,花卉爆炸
Ghost in the Shell 1440x900,hnmgnkeeajpccfmhnkkfnefnfdnbfgnd,Ghost in the Shell 1440x900
Clip Plurk's content to Evernote.,giahclaceijlnhmignnopeipkkeppidg,Plurk Clipper for Evernote
安裝可快速編輯圖像。,bjpmhilaocnimnflbgjoegdagnbhiooe,Google Chrome™圖片編輯器
防止旺中，同時防止打混。原始碼下載： github.com/kosinyj/no-wang-wang,objinplkdlknjdnimkmpckoeocbcfgkf,旺中守門員(兼打混守門員）
"Music for video One-stop AI platform, offering licensed music from musicians. Free-downloadable-music for youtube.",hnoboanddjijipkhimfkinjineabmnfi,A.V. Mapping Sync
2023 Guard Your Privacy on Facebook and Messenger with Ease,fgmiepijfchkhchobiopcemoajoedkkm,ESUIT | Un Seen for Facebook™
"Translation Comparison translates text and compares translations between Google, Microsoft, Yandex and other translators.",kicpmhgmcajloefloefojbfdmenhmhjf,Translation Comparison
一键简单下载谷歌商店的应用评论，支持按照国家、语言、排序规则进行筛选。,cidkoaoofkpbaiicddlmailglcacbabi,谷歌商店应用评论下载器
貨幣轉換器是一個使用方便，能夠迅速檢查當前匯率的工具，而且是免費的。,loeilaonggnalkaiiaepbegccilkmjjp,貨幣轉換器
Kenyon and Knott,eocfjjahdjkfmeandifdaflbpmefjnid,KK
創造與生產一流英國風格陶藝品的 Emma Bridgewater 創立於 1985 年，以用海綿為陶瓷印上 Polka Dot、Pink Hearts 與 Union Jack 等各種圖案而著名。,ennchkafgbngcmjcbbicbobbdomhmklc,Emma Bridgewater
AliPrice以圖搜貨神器可以讓你輕鬆地在跨境電商網站上找到同款貨源。,aadbahhifnekkkcbapdfandpimaoacmj,AliPrice中國進口圖片搜索
讓瀏覽器瞬間變身為最酷的線上音樂寶庫！讓你在不同情境、不同裝置，都能聽到千萬音樂。不但如此，還有編輯與歌手親自推薦的歌單，讓聽音樂有更多選擇。,ocoghcgnimjkpjjciapfddkbfhfklgci,KKBOX Web Player
Your freemium client to access the OpenTouch Experience,gpcpbapinbfiedaonjagghklipeeonnd,OpenTouch Conversation One
將視頻和音頻文件轉換為 .mp3 文件格式！並可以任意添加ID3標籤，支持本地及在線媒體文件轉換為.mp3格式。,ekgllcpppdjkaagfjhdoeacdbihbmban,MP3轉換器 & 下載器
蕃茄鐘® 時間管理助手.,lojgmehidjdhhbmpjfamhpkpodfcodef,Marinara: Pomodoro® Assistant
輕鬆地使用 Google™ 搜尋特定語言與國家的網頁,epdkoleodbfideaklbnclghnpfbfgfne,Glocal
Play your downloaded videos on the Chromecast™ (any file type),cnciopoikihiagdjbjpnocolokfelagl,Videostream for Google Chromecast™
📄  可以方便的查看JSON檔案或請求內容,mlknfiellchbemdiehnihpfkmfhfjnbm,JSON檢視器- JSONViewer
扮演空手而歸的戰士！你能提出最史詩的武術挑戰嗎？ 這,mpemjakldfgiipdeihogjnnjgpgpehgh,Karate Fighter : Real battles
Tab recording software. Dead simple. Free. No watermarks.,mpiihicgfapopgaahidedijlddefkedc,Screensy - screen recording
Sample IME for IME extension API,kfccffigekpdejoikblfdgchmioejgpc,G6 Stroke-based Chinese Input Method (Beta)
Seacrhes the origion of chinese character,ekcknoidgdcnkphpagikhgnfgohkggam,字源右鍵搜
Troubleshoot your LINE Tag installation.,jgnholagndjghcjedffhinifilbjmklg,LINE Tag Helper
"Not Affiliated With Burger Shop nor Gobit Games
We Don't Own The Game
_______________________

Note: 
I don't own this game we took…",lhadijpejgmmjpngghagbieokbhbflml,Burger Shop FREE
Get a red theme for your Google Chrome web browser. And show you valentines day heart in the center of your new tab.,mpofgajadhngaoannkkpkhiblfckenbb,Valentine's Day Theme by Turn Off the Lights
"The next time your kid(s) asks to borrow your phone or tablet for a game of this or that, let him try out this free and colorful 2…",heobjlclbalanaiecfpffdipikhodahg,2 Minutes Math for Kids
"説明

ICT教育授業をサポートする授業支援ソフトウェア「EdClass（イーディークラス）」のChrome版が新登場！…",epkamkbmljkfifbdpiiigohcibdfpnkm,IDK EdClass Student
"Cut The Rope Unblocked now you can play right on Chrome™ Browser! Offline and Popup Version, without internet required!",kbkipceeohlgglbffhdgmfkaaancpglc,Cut The Rope Unblocked
移除Facebook動態上的「推薦粉絲專頁」與「建議貼文」。除此之外也一併移除廣告。,fdhhejjkjfjkchkimomgfegnpapndjne,QCLean: Facebook推薦專頁與建議貼文、廣告移除器
捕捉完整網頁擷圖。擷取，編輯並儲存為 PDF/JPEG/GIF/PNG/BMP ，上傳，列印，傳送至 OneNote 、複製至剪貼簿或以電子郵件寄送。,mcbpblocgmgfnpjjppndjkmgjaogfceg,捕捉網頁擷圖 - FireShot
使用 ChatGPT，您可以使用自然語言與 PDF、PowerPoint、Word 進行對話、提問並立即獲得摘要和答案。,ijgpalnpdopikaldohnjejmcihfaboeg,與 PDF、Word、PPT 對話 | 用於文件的 ChatGPT
NTU COOL 字幕產生器 (Beta) 為 NTU COOL 語音辨識字幕功能的測試版。,docghmaodkaieihebenpieblmcfcoppo,NTU COOL 字幕產生器
"右鍵翻譯選中的文本, 並將翻譯結果添加到生詞本, 每次打開網頁時顯示一個生詞卡, 用來幫助記憶新詞彙",okfkeagmfgmcmfomlifdoojmidpmjnai,Vocab
与好友同步观看 Fancode 视频,ggedddmcehccjajcnndmikemjghnlkgn,粉丝码派对
"This is not doodle jump, now it is t-rex jump. Interested? Try!",cefjeiajjdbdmpjanckdddmjinckkhin,T-Rex Jump game
以日期排序Animen網站番組表,ogabflnjljfjgolihpmbljhiadgiopdc,排序Animen網站番組表
在新選項卡上打開深色主題。在瀏覽器主頁上啟用夜間模式。,egopeokecbgdiiofbemdgbofafjepang,新標籤頁的深色主題
The classic pen and paper game Dots and Boxes.,mfifhnnaifimmocmklopoemgeadkeoki,點與方框
在瀏覽器中體驗 1Password 的最佳方式。輕鬆登入網站、產生密碼和儲存安全資訊。,aeblfdkhhhdcdjpifhhbdiojplfjncoa,1Password - 密碼管理器
一鍵免費選取網頁圖片、視頻、PDF掃描件文字，輕鬆解决頁網內容無法複製難題，支持電腦本地圖片上傳OCR識別,oefooeopdahbeimdgamlblnpegijmdem,快識圖OCR
重新實現 Google 圖片的「檢視圖片」和「以圖搜圖」按鈕。,jpcmhcelnjdmblfmjabdeclccemkghjk,View Image
在線GetThemall所有文件都讓他們全部，Professionel下載。 圖像下載器。,pdijnakepckmpominkocjobdghfohopj,"Getthemall Downloader, 下载器"
霓虹空間壁紙擴展程序重新定義了您的Chrome新標籤頁成為霓虹空間的背景壁紙。霓虹空間粉絲的主題。,ipphcbibjfjobcpjppnidnpimbhckbnh,霓虹空間壁紙高清
在 PDF 閱讀器中輕鬆打開所需的鏈接,kdpmhmcieiaddjoegooocahccoegbemo,Open in PDF Reader
New E3 Auto login,dpkdmcdbmfljkpegjaoiafbdoepeljdg,NewE3 Auto Login
Integration powered by Continuity,hajpnhnjdadkmdodeegefbcipjlphmpk,Continuity
創建新聞文章印刷版和添加定義,pghjgimhknohffcjlgbhjcdmgdhfhfmk,Conradish
"This extension sets currently.att.yahoo.com as your new tab and homepage, and sets your search engine to Currently from AT&T Search",fghadmiogcoldedohbobjngledegaboe,Currently from AT&T
FaWave(發微)，支持多微博的Chrome插件，各微博同時提示、無縫切換。有問題請找 @白一梓 反饋。,elbkcajfelcihnbipppmnodnfahbhbad,FaWave(發微)
"Observing “outlines” of real objects, recognizing their initial and final points and attributing major features – all of which form…",gopnocodldifajhpjlblghkjilaopbed,Edu-Observe Outlines
"VOCALOID 3 - KAITO V3 Theme                                                             


Fits all resolutions up to 1920 x 1080…",mpedlopkhdejhdakjiooihigkgmglakf,VOCALOID3 - KAITO V3 Theme
Brawl Stars wallpapers bring your chrome a new look and useful tools,mcddfiiomdjlhpeoikpglnflfdbehffn,Brawl Stars Wallpapers and New Tab
翻譯目前網頁。,fklckakpjjghgcpdjaboalkfgmbkaanl,翻譯2選1
GBF Auto Copy Room ID,clcgodcllgbancgjajgkbaelmolapmnp,GBF_rooomTool
Service helping to make smart online purchases,dbfipcjecamggjfabeaclacjoohfjhhn,Cashback service Megabonus
免費且更加完善的廣告過濾器。能夠徹底移除所有廣告，不會有任何「可接受」的廣告或廣告供應商白名單，藉以阻絕追蹤和惡意軟體的入侵！,ohahllgiabjaoigichmmfljhkcfikeof,AdBlocker Ultimate
停好车一样快，你可以在此购物商场的停车场。,mjfoehokglnmbbnncflhhgapdfkhahle,商场停车场
使用圖像搜索引擎使牛津英語詞典可視化,ekffngdiljhjmmmfcajfmpheedkonklc,牛津圖片詞典| 視覺英語
讓 Chrome 瀏覽器可以正常瀏覽 NCUE 網路教學平台的「開始上課」選單，順便破解鎖右鍵。,ocflindopkgabjobgmbhifeifnkgkgem,NCUE網路教學平台 Supporter
切换网站你想要暗模式。 黑暗模式将有助于设备节省电量并减轻眼睛疲劳。,nlgphodeccebbcnkgmokeegopgpnjfkc,Super Dark Mode
點擊按鈕縮小當前網頁字體,mpajngnpcmjjeoflljdjpnehcfaldcia,字體變小
"Efficiently View and Interact with PDFs: Easy Navigation, Zooming, and Annotations!",kppkpfjckhillkjfhpekeoeobieedbpd,Easy PDF Viewer
"Browse the Racó, the Intranet of FIB, UPC.",egnnmncnjlhblikhgepadnkacfbeakea,Racó Mobile
IELTS高分詞彙共有1600單詞或詞組，按字典序分組，每組30詞彙，挑戰IELTS高分必備。,ncopoghnenbfedeikdfokakdhokfboeh,IELTS高分詞彙
七龍珠孫悟空壁紙擴展程序重新定義了您的Chrome新標籤頁成為七龍珠孫悟空影的背景壁紙。七龍珠孫悟空粉絲的主題。,laefemhekmempmhnffebdpdkhnnfcfai,七龍珠孫悟空壁紙高清
輔助選取教學評量，請同學依照實際上課情形調整選項,cbpkmppjldjbnjhgcfekpjeeehpdomgn,Quick Click
Theme for Mr.Sakamoto,bdknfeginoafhdkgaleeabbfjkckeddl,Mr.Sakamoto
"NOTE: This app requires a valid Procore account. More info at procore.com
Procore for Android lets you:

- Add Daily Log notes to…",hocbbiojlibhmingpnedopobccdnkgbp,Procore
音量提升高達600％,jghecgabfgfdldnmbfkhmffcabddioke,Volume Master - 音量控制器
Export chat text from ChatGPT,gfaoahbepenfeahphhgpepndfdlkphdj,Out-ChatGPT
為你瀏覽器而生的大量下載工具,nljkibfhlpcnanjgbnlnbjecgicbjkge,DownThemAll!
Boost Your Brainpower with 2048 Classic Game,kgfeiebnfmmfpomhochmlfmdmjmfedfj,2048 Classic Game
當前天氣，包括任何所需位置的每日和每小時預報。,mfogpgphfgmidondkpdipmhaafkieodm,天氣預報
"Play Type Fast Words - HTML5 Game right on Chrome™ Browser! Offline and Popup Version, without internet required!",hpdjibeibfiffgedggakkahldbfehibm,Type Fast Words - HTML5 Game
One Piece  Ultra HD 1366x768,bnommmacifabjjbibbjahnhanegcncjn,One Piece  Ultra HD 1366x768
Basic calculator.,pifijplbggmmagmabhnpkpdoaiepgicc,Calculator
幫助電商賣家以高效率、低成本的方式輕鬆產生高品質的服裝模特兒商拍圖的AI賦能工具。,bmgocepbdfedelhdkimnfljkklmbmihi,VModel - 專為電商賣家打造的AI模特兒製作工具
Integration powered by nTouchTel,nehhmnjfhcnbaedlfbdpinaadjojaimp,nTouchTel
讓你的當前網頁飄雪花,kdcgdhlccojbnonmhcioigcdodakjcmh,雪花
使用套件快速查詢國語小字典,aecidpjpafilgnhklofondnkpnldelli,國語小字典快速查詢
"The saga of Mahjong Dimensions continues, this time with a blitz version",hplmgjdknckigfnpfkpggmkkmpmcecnl,Mahjong Dimensions Blast
,mfknmacoilladpjpopkhdghnpabdffgb,Artlinea Jewels
以太坊瀏覽器擴充插件,aplknenimmngdhgkhajknkgmbpoidmbd,DexWallet
A popup showing the current weather radar,jindcpmlilanofkbcklnaalnlajcdjgm,HKWeatherRadar
Translate anything in one mouse click,enboggfaknddfnohoekbibhcidadficg,AI Translator for Chrome
Click the icon to enable Dark Mode For Chrome. Dark theme for all website with a single move. Black theme for Chrome,ebicpcgpphapkikpnijepngcchnpmbao,Dark Mode for Chrome
Unleash AI Potential: 免费ai创作 ChatGPT Toolkit for Enhanced Conversational Experiences!,okanoajihjohgmbifnkiebaobfkgenfa,免费ai创作 ChatGPT Toolkit
將 HTML5/Flash 影片放到最大，填滿頁面。,bfpkgjlnboeecjmnbhbknmemmckmpomb,Maximize Video
通過閃存卡有效地學習法語詞彙,hgdnelcodfincjfdjoaeiajmnjfliboj,學習法語
Restore the previous new tab page for Chrome 33+.,jliilhbdldnjbdbpajaakhpjpahnopbn,New Tab Reloaded
全球山地預報情況,ajbckkngolnjjlpogamkgjjchhbifpfj,山地預報
Join math-explorer Emma in an all new adventure as she helps her animal friends complete over 100 first grade math games and find…,iikbkpbgiofnjofdcmiiiinljomiafdl,Animal First Grade Math Games Chromebook Free
永不錯過每場會議：自動產生字幕並可免費下載。MeetXCC - 您的個人 AI 會議助理,dgijgfdodcankfloblhnngmlkdaahbco,Google Meet 字幕 - 免費下載
隱藏Gmail™中的所有廣告。,kkddllkaglcicbicjlobbhmjjangamjh,Gmail Adblocker
"IGEmail scrape and extract emails from Instagram follower, following, commenter, liker, hashtag and location",ladgcimodjpcmbnhfinfkancggdemiko,IGEmail - Email Extractor and Scraper for IG
"The image of the theme is from "" 輪郭 "" (RINKAKU) The new single of the Japanese band - DIR EN GREY.

Fits all resolutions up to 1920…",kiohfokfgopllnidofgnpkldfkpdfcgh,DIR EN GREY - RINKAKU
音量提升高達600％,dnkplkhnmhfoddoanflcodkkcngokbhc,Volume Booster 3.0 - 音量控制器
二維碼工具，默認根據當前頁面URL生成二維碼，也可自定義生成內容。,lhlalkpebapgmcolecdeeikopddfkaoi,二維碼工具
"The Chrome version for Quran Android, read Quran from your Chrome Browser!",cehlmencmajnjfmkjjpjhlbjlahfeefg,古兰经
Play the Classic Flappy Bird in new tab,nemoehhfgdeobcmlcmjkgfigddnjlkij,Flappy Bird Classic New Tab
Credit Premium插件,peobdpllmldfpgfbfancnimfllhfjjba,Credit Premium
"Naruto Live New Tab Wallpapers, created just for naruto live fans. Changes your tab to naruto live new tab.",ppemmflajcphagebjphjfoggjcbmgpim,Naruto Live Wallpaper
Persona 5 1366x768,dngopgbpfjjfpehfipagogmchmkodipm,Persona 5 1366x768
提供「HoneyBEES Club (HACHI 中文群)」驗證會員用的瀏覽器插件，詳情請造訪 https:/discord.gg/honeybeesyoukoso,clminacdnjfapkoalgafpolklhoanjbn,HACHI Membership Checker
Google Meet background - virtual backgrounds for Google Meet,lhhpifdkcdahnllampbkpideiogbjplm,Google Meet virtual backgrounds
線上小遊戲社群，免費提供小遊戲，HTML5遊戲，完全免費，即開即玩，不用下載任何軟體！,caokdpgjomacffedfkbfiaacaappcmfn,線上小遊戲社群
Tetr1ster is a popular puzzle game using geometric forms of tetrominoes.,dmfkfgcjjmpdgeoglddefncicgmndhgp,Tetr1ster
"Zeen, building road awareness together! Zeen is a fully featured, community driven mapping solution.

   Features:
   - Over…",oomkmdpihmjnlnihggddepffagdkdalc,WeatherLib
Parse FB comments/reactions/shares and import them into Luckydog Winner Generator,fjjmlofpfnccdaiplopjkgeifgbhiccl,Luckydog Winner Generator Tool
Googleカレンダー予定画面に日報/交通費精算申請画面を埋め込みます。,faimpclaohkkokfjdngjdmbjkapahbhn,サテライトオフィス・日報/交通費精算 for Google Workspace（無償版）
Record Your Screen for Free with Amazing Screen Recorder - The Ultimate Tool for Content Creators!,cdepgbjlkoocpnifahdfjdhlfiamnapm,Amazing Screen Recorder
用於遠程工作的最佳屏幕截圖和屏幕截圖&編輯工具。,nlipoenfbbikpbjkfpfillcgkoblgpmj,Awesome Screenshot 截圖錄屏
最好的m3u8下載器，下載流媒體或下載HLS(Http Live Streaming)為mp4。,gddbgllpilhpnjpkdbopahnpealaklle,影片下載擴充 - CoCoCut
"Play Sudoku Master new generation, Offline version on your Google Chrome! Popup and without internet!",adanmglnaebgigdpnohenfciahchkjnf,Sudoku Offline Game
You can make dino cospaly!!,ghmdcodhffmkgjclaimakmogaacfekch,chrome_dino_cosplay
閱讀原文，不要自動跳到翻譯的網頁。,gjicjdbhbbjjogfedagcnaljepogjioc,Delocalizer
ChatGPT Toolkit can increase your productivity by 10x when using the OpenAI website！,acgbggfkaphffpbcljiibhfipmmpboep,OpenAI Toolkit - AI Prompt For Social Media
清潔緩存和鍍鉻瀏覽數據的最佳方法！我的歷史記錄，刪除下載，清除餅乾，清除緩存或設置自動歷史記錄清潔！,pooaemmkohlphkekccfajnbcokjlbehk,歷史和緩存清潔器 - 智能清潔
This extension shows the external&internal IP addresses when you click the extension icon. https://helloacm.com/what-is-my-ip/,opljiobgnagdjikipnagigiacllolpaj,Show My IP Addresses (External and Local)
一鍵將 ChatGPT 對話保存到 Evernote，輕鬆搜索 ChatGPT 历史記錄。現在試試將 ChatGPT 历史記錄保存到 Evernote！,afcodckncacgaggagndhcnmbmeofppok,將 ChatGPT 历史記錄保存到 evernote
在Chrome 69版本的新UI界面中添加右側快捷打開新標籤頁的按鈕。,dkbpkjhegfanacodkmfjeackckmehkfp,右側打開新標籤頁
My Hero Academia Boku No 1920X1080,ibmmnkgppfaloojhmnagfipnmcebmahj,My Hero Academia Boku No 1920X1080
"Quickly summarizes any Youtube™ video with AI-powered ChatGPT technology. Save time, get the facts!",ddnoogbccnnkchliaabphpimpffbgkia,ChatGPT Summary for Youtube™
"刀劍神域 Sword Art Online（ソードアート・オンライン）Theme

Support Resolution：1600x1200",ehephgcmpogaadegahapggbajibbpopg,SAO_2
,eoeefgfiboofbinemmhjbjbohikdjaee,LMU CUP Mensa
"Now you can play Dinosaur Run - Dinosaur Game right on Chrome™ Browser! Offline and Popup Version, without internet required!",ncbmhlhkeigdflmfnkjpihhmdmdmebmc,Dinosaur Run - Dinosaur Game
必须具备的扩展功能，可以改善视频效果，彩色滤镜，音频增强功能和其他有价值的功能。,jdjldbengpgdcfkljfdmakdgmfpneldd,YouTube Video Effects
"Both a flash card and a quiz tool, TOPIK Locker is designed to help enthusiasts and beginners alike, learn and recognize the basic…",ccckoncejajddigoomndclpemjbockeg,TOPIK Locker
Extreme bass booster app for Chrome that works! Bass Controler with custom settings of bass. Sound booster and Music enhancer,ndhaplegimoabombidcdfogcnpmcicik,Bass Booster - 低音助推器
在Yahoo Mail™中隱藏廣告。,gdiddaiakijbnehjdmbbjpopkgombaed,Yahoo Mail™的Adblocker
SeaMeet提供Google Meet™會議轉錄與筆記整理，產生可持續跟進的待辦事項。,gkkhkniggakfgioeeclbllpihmipkcmn,SeaMeet:實時ChatGPT會議紀錄、摘要和逐字稿
你仍然要炸你的對手和你還拿的對手數目。,pofeokhmkoeboedpnpgplflgkppablkm,玩火 2
使用ChatGPT OpenAI對YouTube視頻進行總結。在YouTube視頻上一鍵截屏和記錄筆記。,baecjmoceaobpnffgnlkloccenkoibbb,YouTube視頻摘要ChatGPT生成-快速筆記(中文版)
"Ford Mustang Black Car theme brings a new look to your Chrome, Edge and Brave browser",cgngcmpncadnddemndmikeplppllihfn,Black Ford Mustang
MayiFree-開水小助手是針對開心水族箱優化所開發擴充。本專案由Chia-Hsin Tsai所開發，並不保證長期維護。,fhkbcfhloihmeddllkkmikdipbaofcjp,MayiFree-開水小助手
????????????????????????????????????,cljcpjmgopflffplmhmnollmeioefgda,Superstar Family - Celebrity Fashion
A Chrome Extension not only translate texts but also images.,oalkcfhdmeianclldfjegbphcapagkjg,MoreThanGoogleTranslate
PinFace is a Face Recognition Application to Control the Access of Employees.,laeokalcbghdgoihppfiodikifecgkpl,PinFace
Integration powered by Cloud9 VoIP,pfiooolgdmjmcpldenddjaadfekdghfj,C9 Connector
通過我們的免費adblocker擴展名阻止煩人的廣告。告別彈出窗口，橫幅以及更多信息，以獲得無縫的瀏覽體驗。,linepocmmjmnmfepinfkfdbmcndjfafb,Web廣告阻滯劑
查看不同時區的時間,nebbdojokcmmhkcmnmijdijimhhiikdj,世界時鐘 - WorldClock
給你一個五星級的 JapHub.com,pomoccbmfihgpobjadbenacgalhbjijb,Clean JapHub
Get Cute Anime Cursors via Naruto Anime Cursors for Chrome,omflgbampleamlpmegfhongjnbbhilhl,Naruto Anime Cursors
"You can download m3u8 live stream video, download m3u8 video in one click",elpdbicokgbedckgblmbhoamophfbchi,M3U8 Video Downloader
"Extract valuable job data from Indeed, including Description, Salary, Location, and Apply Link, saving time.",fomfhkhoobdimlcjafdhbmbceflnpplb,Indeed Job Scraper
Gain immediate access to a collection of striking Temu product images with ease using this superlative photo downloading technology.,mcmapejdcaphjkgijmdkbaodibkpamcc,Temu Product Image Zipper
顯示當前網頁的排名和 SEO 統計數據，主要包括索引數、緩存、鏈接統計、安全信息等。,hbdkkfheckcdppiaiabobmennhijkknn,Open SEO Stats(Formerly: PageRank Status)
