description,id,name
如何從Tiktok廣告庫中下載無浮水印的Tiktok廣告,chhhabidpffkekpjmjcaflgbhleiojfg,如何從Tiktok廣告庫中下載無浮水印的Tiktok廣告
James White 是來自加拿大新斯科細亞省 Halifax 的視覺藝術家。在 11 年的專業生涯裡，包括 Toyota、VH1 Latin America、Armanda Skis 和 Red Bulletin 雜誌等客戶都曾與 James…,bkeidgmehkdjmpjodpjkepolokanalkm,James White
Twitter hot word statistics from your watching timeline,bbdgfpjmgacjlmphhoflbhmbfmpobjcf,Twitter hot word statistics
參加測驗，發現你是哪個功夫熊貓角色！ 可愛的小熊貓怎麼會遇到這麼多麻煩？,cmhihhicjddogdiebicpiochjbcmlfbb,熊貓遊戲
簡單、好看的彈出式視窗書籤,ahlphbdcaacfhkiajebghpngknafklbj,Bookmarkie - 在彈出式視窗中查看、管理你的書籤
在許多熱門網站上切換評論開關狀態。,oklfoejikkmejobodofaimigojomlfim,Shut Up: Comment Blocker
AliExpress價格跟踪器，按圖像搜索，降價電子郵件警報，包裹跟踪，帶有評論的已交付項目的照片。,gcbafooagohnlojhalehlhfemlcbgnco,PriceAli-全球速賣通購物助手
One Piece  Ultra HD 1366x768,lmjfijpgeocncikhehmbobmpfmkhepfa,One Piece  Ultra HD 1366x768
Turns any selected text into a pleasant voice. Listen instead of reading!,ofpofjdkohlmhjppphilpcpjgfenenja,TextSpeecher : Text to Speech
Should I memorize this vocabulary,klgmnlnhghflkhmckiajnkllfjkgkiji,Hello Vocabulary
Display Keywords of Youtube™ Videos,ofklpfiefaifeggoadaeiclnhpkimpnm,Keywords for Youtube™ Videos
"Google News, Google Play Newsstand and BuzzFeed. News aggregator for every country. Weather forecast for Chrome. MSN News.",nefmokhecighaafkkkjikaopldckejmk,News Hub kiosk
提高浏览器速度并保护隐私！一键历史记录、缓存、cookie、跟踪删除等。,bblfiibgoohbopeipfggkckhlnninfbj,Clean Master Pro：快速隐私和清理
Mass Effect Andromeda 1366x768,hnnigaloepkhkgmaipaelgkooccaihfk,Mass Effect Andromeda 1366x768
一個簡單易用的打字助手。 將您的語音轉換為文本。,ecbkhnjhejfjdfimijklmmbcpkilecde,Speech to text - 你說我寫）
David Böhm 是藝術家與插畫家，精通融合油畫手法和攝影技術的繪畫藝術。他目前任職於 DRAWetc 工作室，並時常與 Jiří Franta 合作。,fkafepjhbmdmjpgkaioamejeidodolji,David Bohm
"適用於Facebook, Google, YouTube, Gmail等網站的精美深色樣式",imilbobhamcfahccagbncamhpnbkaenm,Darkness - 精美的深色主題
Can You Build the Tallest Tower? Tower Block Takes Gaming Fun to New Heights!,fnkkegnaemabagohhoebcokpakhanhef,Tower Block
Elite ChatGPT Maximizer 可以加強ChatGPT價值，提高個人效率及專業水平。,jinickjhlohjdhbagljkiomjfimipebn,Elite ChatGPT Maximizer-Boost Your Efficiency
Dark Souls 1920X1080,pkkaljphpjjdhajpmiijanoajijleplf,Dark Souls 1920X1080
Super Cowboy Run 是一款很棒的遊戲，可讓您收集金幣、生命和彈藥來射殺殭屍。 走得越遠越好！,aljdcnlkodnjdbahbogbangnippdmlaf,超級牛仔奔跑遊戲 - 離線運行
輕鬆更改任何字體！ 最佳預設字體的集合。 也可以更改文本的大小和顏色,cngbpbdpdeldglofjjppipdleagpefog,Font Changer
Planet Earth Ultra HD 1600x900,pnbikjaffpaebbnggnejaenhlnaoihmd,Planet Earth Ultra HD 1600x900
快速免費拆分PDF文件！,ekojmgooipeonpigjjclfbflmbjhhkpk,為Google Chrome™拆分PDF
當你準備好發揮好甜美的女孩小遊戲。轉動轉盤可愛到離譜，讓你的華麗吧！,mmmmompbpnoogjjboneabdpebhdpcmgp,女孩遊戲
從 YouTube 中刪除所有煩人的廣告和橫幅！,aghekhbajnlcadepgdkhefijmmbocgjm,Ads Blocker for Youtube™
自動翻譯窩窩頭內的物品法術等英文,lhcokhbkelomecfodcbjhcfdpbaejlen,窩窩頭翻譯器
黃金礦工大冒險是一款有趣的益智遊戲。 收集黃金和寶石。 打敗時鐘，體驗快感。 現在開始你的冒險！,ghcmgkbapfehfphgdogbmocnpeknmffm,黃金礦工遊戲 - 離線運行
一鍵複製淘寶上的產品資訊和快遞資訊,jdplopdpfhclmeobebhjcehomoofhfpg,自動更新淘寶快遞號和輸入集運信息
一款支持超過 100 種語言的 FB Messenger 消息自動翻譯工具(非官方),idaogicjnniebjncgbhlkkjgnaienbnd,消息自動翻譯
"Football New Tab Wallpapers, created specifically for football fans. Replaces your new tab to football new tab wallpapers.",blaajilgooofbbpfhdicinfblmefiomn,Football Wallpapers
Add sparkle to your browsing experience with Custom Cursor Trails! A shiny star trail will follow your mouse cursor on the screen.,cpofhfeclnhnhodbcabgcihloffdpgpd,Custom Cursor Trails
輕鬆管理和加速下載最多5次！,kilhigaineblocfbpikplhgaacgigfnb,在線下載管理器
"Now you can play Mario Run right on Chrome™ Browser! Offline and Popup Version, without internet required!",oceaecnlejbjajbemimlidcgdalaffnc,Mario Run
自動比價、歷史價格、店家優惠與折扣碼，聰明買到最低價！,enlbnppjlpkmjponagpelanookhiejao,BigGo 購物幫手
Change the blue Facebook into a green Facebook,kiakheiecijiajkikjkajibfppjialoc,GreenifyFacebook
一鍵下載 Microsoft Text-to-Speech 網站演示應用合成語音。,dplnecggiofdkdcagdkjebneaonfhbbb,Microsoft™ 文字轉語音下載器 - 添加 TTS 下載按鈕
You can now turn on dark mode on any site.,cilgjbakamckjkiebndhokceglicbodi,Dark Mode
Power Up Your Videos with Adjustable Playback Speed and Effortless Keyboard Shortcuts,ehhbjkehfcjlehkfpffogeijpinlgjik,TurboPlay
Better Youtube 通过许多不同的功能扩展了 Youtube Gaming Livestream Chat,nfbnikpgcldgbpmpckhcajakdhfjjghk,Better YouTube
輕鬆瀏覽，編輯和管理瀏覽器內的SQLite數據庫！,clpnhenadbibdbfendahnlakkcpocmej,SQLite閱讀器
的冒險充滿反彈非凡的森林！,nngmlcoggaojmhoigafihmdepdjgenio,Forest Jump
Youtube to Text：將 YouTube 影片轉錄為文本，產生準確的 YouTube 轉錄本。簡化將 YouTube 影片轉換為文字的過程,apnedodbofogffiagpekmbeflilkcbgf,YouTube 轉文本
我們整合目前主流查核單位的查證資料，並結合AI人工智慧，提供即時資訊查核服務。讓你快速確認資訊內容是否正確，避免接收錯誤的資訊,jnjjhepfpafbhhndhchciimcfkmmfpci,查克佬 Check it Out!
Retro Bowl Unblocked Games 66 is best game you can play right on Chrome™! Have fun!,dacnodnbkeicoghbeijfdjdkmdjmkbda,Retro Bowl - Unblocked Games 66
在Chrome中屏蔽Facebook™廣告,bncnpcfmnfndnbffpggadkdohijjejpj,Block Ads for Social Network
Cacoo為提供您圖表製作、圖表分享與張貼圖表的線上服務。,pcflmbddgcmomcfngehfhlajjapabojh,Cacoo - 圖表繪製與線上即時互動
讓新標簽像電腦桌麵一樣，更漂亮個性，更實用方便。,pcbjnceehmdjneajhlhhgidbccimbbke,星願新標簽頁
通過點選開關達到控制瀏覽器中的各種網頁請求。藉此阻擋網頁指令、嵌套頁面、媒體廣告、社交網站追踪等行爲。,eckgcipdkhcfghnmincccnhpdmnbefki,uMatrix development build
"Now you can play Mini Golf Unblocked right on Chrome™ Browser! Offline and Popup Version, without internet required!",eppbacdflimpeolddgpnnmpnedamaacf,Mini Golf Unblocked
适用于IQ Option平台的IQ Robot机器人的浏览器版本,baigfnhcfjaehfeihnpghahhaceapfme,IQ Robot是IQ Option机器人
勝敗難免開台通知,dhhfpfobgcgjpecokdfpdjnkhejelfko,Ggbb528now
Persona 5 1366x768,bmiocnbgijipkenepdmpogfjdniidkjp,Persona 5 1366x768
"Play Run 3 Unblocked right on Chrome™ Browser! Offline and Popup Version, without internet required! Have fun!",jcbipimadcdfefdpcckaedhohdhnlgbo,Run 3 - Run 3 Unblocked
為您的裝置要求憑證。,fhndealchbngfhdoncgcokameljahhog,Chrome 作業系統憑證註冊
Integration powered by votacall,adjcbniajgiancppcbgoamoookgjghpk,votacall
保護您不受「免費」、中心化的內容傳遞網路（CDN）的追蹤。,ldpochfccmkkmhdbclfhpagapcfdljkj,Decentraleyes
與其他大亨遊戲不同，沒有固定的商業建築模式，但只有很多層次。,kmgcgkcindbbofancfldhiadchhojjlf,大亨遊戲
ASO关键字研究工具——展示应用的最佳关键词，适用于谷歌应用商店的aso优化。,ijegkehhlkpmicapdfdjahdmpklimdmp,APP应用关键词分析（适用于谷歌应用商店）
"OneOptimize AdBlock blocks ads, makes your browsing in Chrome more comfortable",dlbgdlmfkjiffjkchlipihnmbmhnapja,OneOptimize AdBlock
Hunter X Hunter 1920X1080,fmkfpmnhagmbocjacmippbbbmeinkocn,Hunter X Hunter 1920X1080
Spacebar Clicker is the best game for relaxing and entertaining during stressful times at work! Have fun!,ppgajmimhgldadcfelobbbdimgilmncp,Spacebar Clicker
終於有套使用不多的 CPU 及記憶體資源的高效率阻擋器。,cjpalhdlnbpafiamejdnhcphjbkeiagm,uBlock Origin
智剛-工程標案管理系統輔助,bbpcalfggdddkbkgpmldnnpdeklhndob,智剛-工程標案管理系統輔助
CRM Integration,aoinpifbiklbiebbebjkpodnlihmfalk,Cloud PBX
PaperMe - 專業圖像化保險提案系統 是台灣第一套針對「圖表建議書」需求設計的平台，提供多樣化的模板、圖表以及內容設計，讓客戶可以輕易的了解專業複雜的保險規劃內容！,hibecppilpidpbiaeboggfnhebakglfd,PaperMe
Take notes on Linkedin profiles and synchronize them with Google Search results. Organize your Sourcing!,dgafcidlgmbcehokgdeghmfnbpbfhihh,WhenX: Mark Linkedin Profiles with notes
League of Legends Ahri 1366x768,lfaockicnleimkefgcjibjkejhcdggck,League of Legends Ahri 1366x768
玩 Cartoon Candy，一款適合所有人的三消遊戲。 匹配三個或更多相同的糖果。 立即成為三消高手！,odpekllipcohapeeohoagookdalgjamf,卡通糖果遊戲 - 離線運行
聲音增強器可將任何標籤中的音量提高到最大程度。真正有效的音量增強器！將聲音放大高達500%。,bjpebnkmbcningccjakffilbmaojljlb,增強器 - 低音增強器
觀看YouTube視頻的高清自動,iaddfgegjgjelgkanamleadckkpnjpjc,Auto Quality for YouTube™
立即打開當前頁面的 PageSpeed Insights 性能測試 ⚡,pnibhbifpoiplpgkaajjejeigfchahpl,PageSpeed Insights 快捷方式
在 Youtube™ 視頻的浮動窗口中畫中畫觀看。,ojifdhbgdcomkadeelhedgbcldnbmbfd,Youtube™ 視頻的浮動視頻播放器
Counter Strike Global Offensive 1366x768,mdcbaoglacpffphbkpaehgobnjonbhpi,Counter Strike Global Offensive 1366x768
從奇摩超級商城快速上架到其他賣場,jgipgkkcchjfmabbbmeckhlefklccmna,快速上架工具 HTML版
走時髦、性感風格的 Rampage，是當前最知名、最受歡迎的時尚品牌。,cknkimpcfkpmmikggddpidpmaljigegp,Rampage
Integration powered by Sumo Fiber,gbajohhoggdejnhfdhihfooihfnbmabo,Sumo Fiber
League of Legends Yasuo 1366x768,alkchklkecmmdacembmdbaaehlbhoddk,League of Legends Yasuo 1366x768
快速搜尋九巴預計到站時間(非九巴官方應用程式),gfmaaoemhpolpfnpeglggicmnmppleah,香港九巴(KMB)預計到站時間查詢小工具
萬聖節壁紙擴展程序重新定義了您的Chrome新標籤頁成為萬聖節的背景壁紙。萬聖節粉絲的主題。,pjpjigpkpbpoolaklojnninmlhpgflkl,萬聖節壁紙高清
使用 XMR.to 將 Monero 直接轉帳到 Bitcoin 的地址,bopmplclhbjcdpjiecjpmfkkainjmfda,XMR.to Lens
币安智能链瀏覽器擴充插件,dohegamlpbhmcbjndidlefigiinmhoij,VOODOO WALLET
此擴展程序允許您根據您的喜好自定義Scratch網站頂部的導航欄。它也可以用來替代“討論”按鈕。,emnafibodmpbnaokljinkcaoeffdfhcb,#Bring It Back
快速免費打開TIFF文件,khfjibjnkggggcnlhhndboookgakliep,TIFF Viewer for Google Chrome™
快速開啟設定的URL,ipplkgannkoageolbhdgbkmphfmhopaj,網頁一鍵快捷
,nomfckajoamimkcaikleclfjmjpckpof,RU UFPR
多達4個玩家在同一屏幕上。黨的一個完美的遊戲的朋友,gcainghaohodpojneenpdnoijdnmmgdf,Sheep Party : 1-4個球員
原價屋快速搜尋套件,biaodlmdjlkhhllcdgabfipilkjjekhh,Coolpc Search
"Useful extension for taking screenshots and adding annotations to them. Visualize, annotate, and share screenshots in a few clicks!",maehgokeeglkcmoncpimbdhbhfhhafhi,Free Screenshot Capture & Annotation Tool
Read in a smart way.,kgmidkgmebgjingfoogaodpcpifomgbp,Smart-Read E-book Reader
Invite all facebook post likers with one click (works in NEW FB interface),cajeghdabniclkckmaiagnppocmcilcd,Invite All Friends for Facebook in one click
Watch online videos while surfing the web with picture in picture mode,lppddlnjpnlpglochkpkepmgpcjalobc,Picture in Picture player
於 OpenRice 上顯示餐廳是否於禁食名單內,pliohkckjjidlnlnkmdhpffimjfioikf,BlockRice
A cat that shoots a laser from its eyes will destroy everything you want to destroy on the web page,eocaghofhhmedfpjhnfcmfjojngncpdp,Laser Character - Page Destroyer
Wire是款極簡設計、漂亮的應用軟體。你能透過它和好友們在個人或群組聊天室發送文字、圖片、影片和進行語音通話。,kfhkficiiapojlgcnbkgacfjmpffgoki,Wire
《重返大航海》是一款以15-16世紀大航海時代為背景的創新策略遊戲。,daljkmighnnfjmjffbconmolpohhabcl,重返大航海
"Découvrez l'application officielle des cinés Wellington de Waterloo.
Parcourez notre programmation de films, découvrez les…",koijnhbhgpdjnjlfpjocnpphacfmfjkd,Cinés Wellington
協助取得全聯〔進銷存貨況查詢〕資料，可選擇單一廠商或全部商品。 for 全聯 2023/07 上線版本,jankbnjlnbfcednalkpkagbiidcbhbfm,getChuanLainPSI
This is an Open-AI ChatGPT powerful tool (Ins : ChatGPT 中文版) to give you the AI magic on TikTok for marketing promotion.,ighcgnijpnfppnggmjcpgbphjmlomcpo,OpenAI Chat GPT For TikTok : Chat GPT 中文网
台灣房屋首創領先業界服務，整合線上多家銀行方案與貸款須知，解決消費者對房屋貸款的種種問題，成為消費者尋找房屋貸款的最佳小幫手。,canoidjfpllpdiobkdmjohokdpmfjlah,台灣房屋-房貸E達人
檢查互聯網下載/上傳/ Ping,gdnecenghnhncffihomlapjpiedgegng,Wifi 速度測試
Minecraft wallpapers bring your chrome a new look and useful tools,hogcofdjpeefkblkjdghifgppconhhak,Minecraft Wallpapers and New Tab
"飛比購物幫手:歷史價格通通掌握,比價破億商品,網購最佳幫手，讓你花最少，買最好！",lmldjiibpfhdjjdjapcdlpjgeaihflpi,飛比購物幫手：網路購物即時比價工具
YTCooooooler is cooooooool,nijecilfkjecbilnmkjfcnpedcdmnbnk,YTCooooooler
Retrieve and store Mooltipass credentials easily from websites,ffemldjbbfhimggdkkckolidemlllklk,Mooltipass Extension
This extension supports for playing King,olimeoldoojhjchelhfbaaknocojhikl,"夜就輕輕地來了, 開始阿明謀"
购物小帮手：真实卖家评分；跟踪产品价格走势；降价提醒；查找同类产品,nbmkdnpgneknmkpmoabmmddklcgppldd,AliExpert - 价格历史和卖家评级
momo購物轉址，將m.momoshop轉址到正常的momo購物,bihbjhdifbafkenihgfdbepndgkkcjda,momo購物轉址
Death Note  1366x768,odppebklklagpkhhihgmaekbffkiabcp,Death Note  1366x768
通過Sonatype Platform瀏覽器擴展來達到“安全左移”——掃描開源倉庫以檢測已知漏洞。,kahnhlonadjlllgnilndafpajaiepdag,Sonatype Platform瀏覽器擴展
Show popup of Japanese vocabulary when double clicking on any text in webpage,eknkjedaohafedihakaobhjfaabelkem,MOJiDict Helper
Free +200 HTML5 games. Instant Online Games. No Install. Messenger Games. Marketplace millions of users. Works Offline.,enhnhpibeofnhkhcakhmlbmhplfjhnjd,Instant Games
简繁轉換,cpikgpboofnnnbeoekolnmllkhnhoocg,convZH
作為 Chrome 擴充套件來玩 Doodle Jump Unblocked - 也可在沒有網路的情況下遊玩，立即試試看！,jcggecfjicjifingepabnoglbglodpfc,Doodle Jump 沒有封鎖
Casino Cards Memory 遊戲是一款有趣的技巧遊戲。 找到相同的卡片對！ 提高你的大腦記憶力。 享受！,mhabgichpphlmlmofbedgkaidchgigch,賭場紙牌記憶遊戲 - 離線運行
Chrome擴展管理器 chrome://extensions/，主要擴展名稱，擴展名列表，刪除擴展名，編輯,ejhgmicchekbcipcccpednobcinboggd,Chrome Extension Manager | Master
Smart. Simple. Beautiful Theme.,phcgjdgneipghoeikoeenifpknfkjpil,Slinky 魅力
為日文推(twitter.com)添加假名標注,hbekfodhcnfpkmoeaijgbamedofonjib,mirigana
FreeSaver - Free save and share web contents,cblalpojiaadbiimacpklbponocmjkkf,FreeSaver
Nier 1366x768,hdephjffdkcmckhhdoecnpklpdlfldim,Nier 1366x768
將網址中的追蹤元素一掃而空,lckanjgmijmafbedllaakclkaicjfmnk,ClearURLs
"外部链接直接重定向，无需点击。csdn, 知乎。目前支持为参数名称 target 或者 url 的",dfkjgfdnlfabkoanlkfikdjgcjgjemol,外部链接直接重定向
基於 Tesseract 與 Marvinj 之模糊影像辨識，自動填入學務系統驗證碼。,flbelgaeblnoipjndnjgmmafbgpclfcf,潑頭天眼通
Find any user manual for many brand products from your browser toolbar,cmadiiiggcaaelekacljabmbebfghaif,Find Manual
此擴充功能會打開兩個分頁，並在它們之間進行指定回合數的文字交流。,elgfamgapnaflgdmndekkodcmhkpjilh,Camelia
由 Microsoft 搜尋提供您最愛的 Microsoft Solitaire Collection 遊戲,acehchockcmgigjilbjhecnepiohkfld,具備搜尋功能的 Microsoft Solitaire Collection
「滑鼠點一點就好」的監控網頁資料神器,agoklhpignkeigeeepfpknnhfmgkfihl,Quokka: 無腦串接網頁資料
"WFduino 能夠讓 Arduino 支援 Scratch 和 ScratchX, 以及 WF8266R.js 平台。透過 USB 藍芽 或 WI-FI 多樣化的傳輸媒介, 讓你輕鬆玩轉物聯網。 http://wf8266.com/wf8266r",obhhkieikmdbbjggcnmjihnhlnammdda,WFduino for Scratch
The Witcher 3 Wild Hunt 1920X1080,dalgpdacjpphcdibfbjagehiepoboekc,The Witcher 3 Wild Hunt 1920X1080
CRM Integration Powered by Gabbit,epofkoafdlgaehedjbmcicbbjeklmjnh,Gabbit
一鍵從 twitter 或 TweetDeck 下載影片和圖片。,hpcgabhdlnapolkkjpejieegfpehfdok,Media Harvest : twitter 多媒體下載器
Powered By SHOPAGE,bibehbmohkdoojpplnkbjdpfchjbjcld,SHOPAGE順豐自動化印單插件
"原名:Gestures for Chrome(TM)繁體版.方便,快捷,充分發掘鼠標的所有操作.功能包括:鼠標手勢,超級拖曳,滾輪手勢,搖桿手勢,平滑滾動,分頁列表等.",mjidkpedjlfnanainpdfnedkdlacidla,CLEAN crxMouse Gestures
管理你的分頁；增進你的瀏覽品質；並使你在開啟大量分頁時，還可以維持理性。,amigcgbheognjmfkaieeeadojiibgbdp,TooManyTabs for Chrome
Viking Escape - 控制龍上的維京人以逃避地精和突變體。 爭取自由並進行史詩般的冒險！,bdijnblfekhmbcoickjomdlnngiejfbh,維京逃脫遊戲 - 離線運行
Hostlink (HK) Ltd.,icblahjifcmkikgclnojlkjkjphbmndc,Hostlink CMS
Instantly Translate Words and Text Snippets on Web Pages with a Single Click with Inline Lingo,hmioicehiobjekahjabipaeidfdcnhii,Inline Lingo
"Now you can play Battle City Classic Game right on Chrome™ Browser! Offline and Popup Version, without internet required!",mgaoplldmbcohibpbdedomcadllhjcde,Battle City Classic Game
"Now you can play Car Parking Unblocked right on Chrome™ Browser! Offline and Popup Version, without internet required!",ddoogcmcjnilclmbfdgfbpnokgebijlm,Car Parking Unblocked
Flappy Bird for Chrome is a classic arcade game,dpfpohilcgfbohkciadifcfcllhcppcc,Flappy Bird for Chrome
Download png in MMIS,cmimoofmnagcnclglolnooobeemlanjd,MMIS crawler
"House Of Hazards is our best game you can play right on your browser, without internet, popup, relax and have fun!",ijedfcaldfkopldcgeaddopgfplncnam,House Of Hazards
電商印單小幫手 (Delivery Order),dbgbpfefnifpdkieggikljahlmmbdial,電商印單小幫手
會議功能所必須的擴展程序，幫助您隨時隨地與所有人協同工作。,ncopmpddfokfcmmnhhbekaecjbokeeck,會議擴展程序
轻松快速地合并 PDF！拖放和排列以实现无缝合并。非常适合学生、专业人士等。,jhgmclggpkmmkkjnjcihjndbapckmcom,Swift PDF Merger：轻松合并 PDF
自動頁面刷新以重新加載網頁。,amloklcaibgdommdfkhpjjeopdjmmaoe,自動複習
阻止您每天瀏覽的所有網站上的廣告和彈出窗口,cmdgdghfledlbkbciggfjblphiafkcgg,SBlock - 超級廣告攔截器
This extension can remove a list of URLs from Bing via Bing Webmaster Tools with one click. You don't need to copy and paste…,knhcaipgfilkpgkejhmjbgklpalkaahi,Bing Webmaster Tools - Bulk Url Removal
Quickly compress JPEG images,jjmbbhbbjmljofmfnhlfhdnljgeckecf,Compress JPEG
將點子儲存到 Pinterest。,gpdjojdkbbmdfjfahjcgigfpmkopogic,儲存到 Pinterest
YouTube視頻摘要帶有Chatgpt擴展名，請參見視頻的成績單，並總結YouTube視頻。,bjbgpibihapchmkboankeminjcnmhelm,YouTube摘要與Chatgpt 4
An Ethereum Wallet in your Browser,bjdhiccoieljgfekococojhkkmbocekp,Defed
mei's Handy Tool provides some useful features for browsing、present and everything you need.,ahkmfhnnaehikaaphccaonmddgcjdhee,mei's Handy Tool
"國立聯合大學課表擷取與下載插件
使用方法:
登入聯合大學校務資訊系統>課務管理>學生課表>點選學生課表選擇年度並按下確認>使用插件的抓取課表，便可抓取到課表資料。",odbidfamibggbnfblnbgjmeeacidcnkf,nuu課表擷取與下載
從 Facebook、Twitter、Instagram、Vimeo 和許多其他熱門網站下載視頻。 適用於 FB、Twitter、Instagram 的視頻下載器,knkpjhkhlfebmefnommmehegjgglnkdm,視頻下載器 - Video Downloader
"A browser plugin to export ChatGPT dialog as markdown, easily edit & retain text format.",adghjpdmpbcmppeafpodcjpagmegdpci,ChatGPT to Markdown
"Powerful video downloader. Pro download manager: save video, download music and images, managing downloads, etc.",opjjpmhoiojifppkkcdabiobhakljdgm,在线下载管理器 - 视频下载器
從nicovideo.jp下載動漫視頻，音頻音樂mp3，縮略圖，漫畫,jefkdjjbbmlokldmpehimfdefdcklagj,很棒的NicoNico下載器
從 TikTok Feed、TikTok 廣告庫和 TikTok 創意中心查找熱門廣告。,fhpkcpknckbhgndefnbphgakdjinnckp,廣告庫 - TikTok 的廣告間諜工具
從無所不知的 ChatGPT 中生成無盡的答案 (任何語言!),amikeononomkhphopbflomhnmdijjpmb,ChatGPT 無盡
SaveTik - Tik Tok Downloader,lilbblbpakjjohhllknkgcgfabehbiai,SaveTik - Tik Tok Downloader
Attack On Titan Severity 1920X1080,paboafphmgcjhehncihmldnbcnkpnnkl,Attack On Titan Severity 1920X1080
東京喰種壁紙擴展程序重新定義了您的Chrome新標籤頁成為東京喰種的背景壁紙。東京喰種粉絲的主題。,dakaicilmdccpknldllaednpmbhgmamp,東京喰種壁紙高清
A minimal notepad.,dfjihdkgnffgahhikldnjjfioahnlpdj,Caderno
簡短說明：最簡單的cookies管理器，智能，快速，易於使用，具備您需要的所有高級工具。,efmbllenocpgfaedkjnlnbacalkajolk,Cookies by lfj.io
槍從史前到現代。,nkonhlelkinoldhllfifkldlecfnndml,戰爭時代
OSKA adblock plus 免费的广告拦截器 is a relentless ad blocker. Don’t let any ad slip through.,gfmcgjbfiphmbglaepmbcbkbcchniedc,OSKA adblock plus 免费的广告拦截器
"This intuitive and feature rich finite element app is especially useful for civil engineers, mechanical engineers, architects and…",himjepbhchnfjcecpaadmlmocipdgopk,FrameDesign
Make the circle jump and avoid hitting the line!. How far can you go? WARNING: Highly Addicting!,pnllmjnlehkpomldfdfbdjacjcihfmif,Flappy Circle
transform text from TAIWAN to ROC in news,idinldkceljpagnbidadlckofnicgleb,News Transformer
一種上癮的蹦床比賽中，使用箭頭鍵移動你的手臂和腿，在空中做出漂亮的姿势。,jhmifohpcboepjemofbbghonheafdphh,超級蹦床
"同時看所有討論室的學生，全面免費，資料不外洩，中文板的說明影片， 與谷歌教室整合, 滑桿控制, 控制面板，暱稱連結",kogfdlbehkaeoafmgaecphlnhohpabig,Google Meet 分組 by 胡浩洋
"2023-10-17 v1.0.1

追加了 3.23 祖靈聯盟的更新。
* 家裡新增了幾位成員，有魚、有蛙、有蜥蜴，他們過得很快樂。
* 希望有一天可以在家上班。

---

使用 POE Ninja…",gglmcnkdkmplojiepoigahmdkeegfgff,POE Ninja 中文化
【Bobitag 片段創作大師】 讓你在觀看影片的當下，不用離開Youtube，第一時間轉成GIF檔，迅速分享與下載！搭配其他加值功能，操作簡單方便又直覺，是您不可多得的影音工具！,ppfmnldfgjaohehipnlconehomehogan,BobiTag
stock,bgmkbhkdfocgghilpgkgbnphincclgko,股海小幫手
以 Chrome 擴充功能玩 Cookie Clicker 原始遊戲 - 也可以在沒有網路的情況下玩，立即嘗試！,kdpoepidbmjljpneoopafdmiokkgfffh,餅乾唱首歌原創遊戲
Current OTC 3293.TW Price on badge Icon,mjneebkfcpanfdgdebfmbdlbhnbnndhd,OTC 3293.TW
"Tired with old puzzle games like jigsaw puzzles, block puzzle, even legendary Tetris, Line or other puzzle games? So Unite puzzle…",iglljnipmlehmkaopjildkphcoeemhbf,Unite Lite
選擇需要閱讀的文字，讓Talking Web來讀給妳聽！,hdeikpphnbclpacdjdjjkpmbcacopnog,Talking Web
從Google雲端硬盤或本地計算機查看DXF文件。,afldoemlfmlnpogifjjnngkpfogaamdm,適用於Google Drive™的AutoCAD Viewer
玩對戰遊戲。戰爭迷霧要臨到你，把勝利的王和土地。,efbgjfgijdlheiojdkofjcgcnpkggika,戰鬥遊戲
Sigerson Morrison 創立於 1991 年。Kari Sigerson 與 Miranda Morrison 在就讀 FIT 設計學校期間相識，她們對美學的想法很相似，而且都鍾情於為喜歡獨特風格的時髦女性設計鞋款與飾品.,hcpgmpfeoahblfncaooigccakcgngjbh,Sigerson Morrison
單擊自動查找並應用優惠券代碼，獲取價格跟踪器，價格下降警報，最近的價格下降等功能,adikhbfjdbjkhelbdnffogkobkekkkej,翻蓋：價格跟踪器等等
Snappy 每天為您放送由 1842 年至今超過 500 張的香港街景相片。,kjieibacnclikhbmjboepkfbmdkpgkoo,Snappy 每天放送
包括圖像放大器、照片增強器、圖像模糊處理、圖像放大器、照片著色器、圖像銳化器等。,bhidkdphakccobnmmbalkoabicbhckpn,照片恢復 - 立即恢復照片
"Site Blocker for Productivity, Parental Control, and Addiction Management: Protect Your Online Access with FocusShield",ohdkdaaigbjnbpdljjfkpjpdbnlcbcoj,FocusShield
